"8210 Aarhus V","Trafikuheld: Politiet jagter flugtbilist ",http://tv2oj-juan2015.develop.fynskemedier.dk/artikel/281557:Aarhus--Trafikuheld--Politiet-jagter-flugtbilist
"8900 Randers C","Tricktyve på spil i supermarked ",http://tv2oj-juan2015.develop.fynskemedier.dk/artikel/281563:Randers--Tricktyve-p--spil-i-supermarked
"8600 Silkeborg","Planer om nyt Jorn Museum til 500. mio. kr. ",http://tv2oj-juan2015.develop.fynskemedier.dk/artikel/281564:Silkeborg--Planer-om-nyt-Jorn-Museum-til-500--mio--kr
"8200 Aarhus N","Forurening bremser operationer",http://tv2oj-juan2015.develop.fynskemedier.dk/artikel/281566:Aarhus--Forurening-bremser-operationer
"8462 Harlev J","Kvinde kom hjem - tyvene stak af",http://tv2oj-juan2015.develop.fynskemedier.dk/artikel/281570:Aarhus--Kvinde-kom-hjem---tyvene-stak-af
"8200 Aarhus N","Skoleelever får del i Tivolis julelys",http://tv2oj-juan2015.develop.fynskemedier.dk/artikel/281580:Aarhus--Skoleelever-f-r-del-i-Tivolis-julelys
"8600 Silkeborg","Statsstøtte til vestdansk filmpulje ",http://tv2oj-juan2015.develop.fynskemedier.dk/artikel/281590:oestjylland--StatsstOette-til-vestdansk-filmpulje
"8000 Aarhus c","Statsstøtte til vestdansk filmpulje ",http://tv2oj-juan2015.develop.fynskemedier.dk/artikel/281590:oestjylland--StatsstOette-til-vestdansk-filmpulje
"8305 Samsø","Borgmester-effekt? S går frem på Samsø",http://tv2oj-juan2015.develop.fynskemedier.dk/artikel/281591:SamsOe--Borgmester-effekt--S-g-r-frem-p--SamsOe
"8700 Horsens","Sponsorerne svigter AC Horsens",http://tv2oj-juan2015.develop.fynskemedier.dk/artikel/281597:Horsens--Sponsorerne-svigter-AC-Horsens
"8305 Samsø","V: Slut med at pege på en socialdemokrat",http://tv2oj-juan2015.develop.fynskemedier.dk/artikel/281605:SamsOe--V--Slut-med-at-pege-p--en-socialdemokrat
"8900 Randers C","Vilde planer: Vil opføre stor champagnevingård ved Randers",http://tv2oj-juan2015.develop.fynskemedier.dk/artikel/281606:Randers--Vilde-planer--Vil-opfOere-stor-champagneving-rd-ved-Randers
Ingenting,"Weekenden bliver kold og vinterlig",http://tv2oj-juan2015.develop.fynskemedier.dk/artikel/281612:oestjylland--Weekenden-bliver-kold-og-vinterlig
"8900 Randers C","LIVE: Se politisk debat fra Randers",http://tv2oj-juan2015.develop.fynskemedier.dk/artikel/281614:Randers--LIVE--Se-politisk-debat-fra-Randers
"8000 Aarhus c","Bundsgaard om radikalisering: Vi skal stå sammen",http://tv2oj-juan2015.develop.fynskemedier.dk/artikel/281619:Aarhus--Bundsgaard-om-radikalisering--Vi-skal-st--sammen
"8900 Randers C","Randers: De er alle tre sure på borgmesteren",http://tv2oj-juan2015.develop.fynskemedier.dk/artikel/281621:Randers--Randers--De-er-alle-tre-sure-p--borgmesteren
"8660 Skanderborg","Blev handy-woman og slap af med stress",http://tv2oj-juan2015.develop.fynskemedier.dk/artikel/281623:Skanderborg--Blev-handy-woman-og-slap-af-med-stress
"8000 Aarhus c","Århus snupper sent point i Skjern",http://tv2oj-juan2015.develop.fynskemedier.dk/artikel/281629:Aarhus---rhus-snupper-sent-point-i-Skjern
"8900 Randers C","Omann: Vi kommer nok aldrig til at elske hinanden helt",http://tv2oj-juan2015.develop.fynskemedier.dk/artikel/281637:Randers--Omann--Vi-kommer-nok-aldrig-til-at-elske-hinanden-helt
"8600 Silkeborg","Silkeborg-Voel satte Aarhus på plads",http://tv2oj-juan2015.develop.fynskemedier.dk/artikel/281640:oestjylland--Silkeborg-Voel-satte-Aarhus-p--plads
"8000 Aarhus c","Silkeborg-Voel satte Aarhus på plads",http://tv2oj-juan2015.develop.fynskemedier.dk/artikel/281640:oestjylland--Silkeborg-Voel-satte-Aarhus-p--plads
"8000 Aarhus c","Bears videre i Europa efter ny sejr",http://tv2oj-juan2015.develop.fynskemedier.dk/artikel/281641:Aarhus--Bears-videre-i-Europa-efter-ny-sejr
"8900 Randers C"," Randers HK spillet af brættet",http://tv2oj-juan2015.develop.fynskemedier.dk/artikel/281643:Randers---Randers-HK-spillet-af-braettet
"8305 Samsø","Marcel Meijer: Utrolig glad for opbakning",http://tv2oj-juan2015.develop.fynskemedier.dk/artikel/281646:SamsOe--Marcel-Meijer--Utrolig-glad-for-opbakning
"8305 Samsø","Ekspert: Samsø gode til at få folk i arbejde",http://tv2oj-juan2015.develop.fynskemedier.dk/artikel/281647:SamsOe--Ekspert--SamsOe-gode-til-at-f--folk-i-arbejde
"8900 Randers C","Pas på aqua-planing torsdag morgen",http://tv2oj-juan2015.develop.fynskemedier.dk/artikel/281660:oestjylland--Pas-p--aqua-planing-torsdag-morgen
"8000 Aarhus c","Aarhusianske sejlere tæt på VM-guld",http://tv2oj-juan2015.develop.fynskemedier.dk/artikel/281665:Aarhus--Aarhusianske-sejlere-taet-p--VM-guld
"8305 Samsø","Tilbageblik: V og K kunne ikke blive enige ",http://tv2oj-juan2015.develop.fynskemedier.dk/artikel/281668:SamsOe--Tilbageblik--V-og-K-kunne-ikke-blive-enige
"8300 Odder","Institution klager over kommunen",http://tv2oj-juan2015.develop.fynskemedier.dk/artikel/281671:Odder--Institution-klager-over-kommunen
"8500 Grenaa","Hvem skal tegne midtbyen i Grenaa?",http://tv2oj-juan2015.develop.fynskemedier.dk/artikel/281680:Norddjurs--Hvem-skal-tegne-midtbyen-i-Grenaa
Ingenting,"Falck opfordrer: Skift til vinterdæk inden sneen kommer",http://tv2oj-juan2015.develop.fynskemedier.dk/artikel/281684:oestjylland--Falck-opfordrer--Skift-til-vinterdaek-inden-sneen-kommer
"8870 Langå","To anholdt for at stjæle kobberwirer",http://tv2oj-juan2015.develop.fynskemedier.dk/artikel/281688:Randers--To-anholdt-for-at-stjaele-kobberwirer
"8400 Ebeltoft","Kvadrat-chef kåret som Årets Ejerleder 2015",http://tv2oj-juan2015.develop.fynskemedier.dk/artikel/281699:Syddjurs--Kvadrat-chef-k-ret-som--rets-Ejerleder-2015
"8000 Aarhus c","Varsel om sne har skabt pres på værksteder",http://tv2oj-juan2015.develop.fynskemedier.dk/artikel/281708:oestjylland--Varsel-om-sne-har-skabt-pres-p--vaerksteder
"8600 Silkeborg","Jyske Bank frifundet i sag om swaplån",http://tv2oj-juan2015.develop.fynskemedier.dk/artikel/281709:Silkeborg--Jyske-Bank-frifundet-i-sag-om-swapl-n
"8000 Aarhus c","Jyske Bank frifundet i sag om swaplån",http://tv2oj-juan2015.develop.fynskemedier.dk/artikel/281709:Silkeborg--Jyske-Bank-frifundet-i-sag-om-swapl-n
"8900 Randers C","Fodgænger ramt af 18-årig bilist",http://tv2oj-juan2015.develop.fynskemedier.dk/artikel/281713:Randers--Fodgaenger-ramt-af-18--rig-bilist
"8000 Aarhus c","Anholdt efter brosten-kast mod guldsmed",http://tv2oj-juan2015.develop.fynskemedier.dk/artikel/281729:Aarhus--Anholdt-efter-brosten-kast-mod-guldsmed
"8000 Aarhus c","Millioner til ældreplejen i hele Østjylland",http://tv2oj-juan2015.develop.fynskemedier.dk/artikel/281733:oestjylland--Millioner-til-aeldreplejen-i-hele-oestjylland
"8600 Silkeborg","Han skal stå i spidsen for kulturen",http://tv2oj-juan2015.develop.fynskemedier.dk/artikel/281734:Silkeborg--Han-skal-st--i-spidsen-for-kulturen
"8900 Randers C","Lokal- og brødrebrag i Basketligaen",http://tv2oj-juan2015.develop.fynskemedier.dk/artikel/281737:oestjylland--Lokal--og-brOedrebrag-i-Basketligaen
"8700 Horsens","Lokal- og brødrebrag i Basketligaen",http://tv2oj-juan2015.develop.fynskemedier.dk/artikel/281737:oestjylland--Lokal--og-brOedrebrag-i-Basketligaen
"8000 Aarhus c","Forening: Andelshavere i swap-knibe bør ikke droppe sager",http://tv2oj-juan2015.develop.fynskemedier.dk/artikel/281742:Aarhus--Forening--Andelshavere-i-swap-knibe-bOer-ikke-droppe-sager
"8660 Skanderborg","Harmonika-sammenstød skaber kø",http://tv2oj-juan2015.develop.fynskemedier.dk/artikel/281747:Skanderborg--Harmonika-sammenstOed-skaber-kOe
"8600 Silkeborg","VIDEO: Det nye stadion i Silkeborg blev sparket i gang",http://tv2oj-juan2015.develop.fynskemedier.dk/artikel/281754:Silkeborg--VIDEO--Det-nye-stadion-i-Silkeborg-blev-sparket-i-gang
"8305 Samsø","Mulig tilflytter: Giv ren besked om færge",http://tv2oj-juan2015.develop.fynskemedier.dk/artikel/281757:SamsOe--Mulig-tilflytter--Giv-ren-besked-om-faerge
"8900 Randers C","Borgmester: Oplagt at flytte politiskolen til Randers",http://tv2oj-juan2015.develop.fynskemedier.dk/artikel/281758:Randers--Borgmester--Oplagt-at-flytte-politiskolen-til-Randers
"8305 Samsø","LIVE: Se politisk debat fra Samsø",http://tv2oj-juan2015.develop.fynskemedier.dk/artikel/281765:SamsOe--LIVE--Se-politisk-debat-fra-SamsOe
"8000 Aarhus c","Efter omtale: Retarderet får statsborgerskab",http://tv2oj-juan2015.develop.fynskemedier.dk/artikel/281767:Aarhus--Efter-omtale--Retarderet-f-r-statsborgerskab
"8305 Samsø","Fik ikke færge-penge: Skuffet borgmester",http://tv2oj-juan2015.develop.fynskemedier.dk/artikel/281770:SamsOe--Fik-ikke-faerge-penge--Skuffet-borgmester
"8305 Samsø","Politiker: Samsø kan ikke klare sig selv",http://tv2oj-juan2015.develop.fynskemedier.dk/artikel/281773:SamsOe--Politiker--SamsOe-kan-ikke-klare-sig-selv
"8305 Samsø","Fik pæl gennem hovedet: Glad for livet i dag",http://tv2oj-juan2015.develop.fynskemedier.dk/artikel/281775:SamsOe--Fik-pael-gennem-hovedet--Glad-for-livet-i-dag
"8305 Samsø","Samsø-politikere vil undersøge færge til Aarhus",http://tv2oj-juan2015.develop.fynskemedier.dk/artikel/281780:SamsOe--SamsOe-politikere-vil-undersOege-faerge-til-Aarhus
"8900 Randers C","Forventet sejr til topholdet i Randers",http://tv2oj-juan2015.develop.fynskemedier.dk/artikel/281783:Randers--Forventet-sejr-til-topholdet-i-Randers
"8660 Skanderborg","Skanderborg løb ind i overmagten",http://tv2oj-juan2015.develop.fynskemedier.dk/artikel/281786:Skanderborg--Skanderborg-lOeb-ind-i-overmagten
"8500 Grenaa","Voldsom brand i 1300 bigballer nær Grenaa",http://tv2oj-juan2015.develop.fynskemedier.dk/artikel/281789:Norddjurs--Voldsom-brand-i-1300-bigballer-naer-Grenaa
"8220 Brabrand","Allan og Bente flyttede med Forsvaret",http://tv2oj-juan2015.develop.fynskemedier.dk/artikel/281792:Aarhus--Allan-og-Bente-flyttede-med-Forsvaret
Ingenting,"Tør og solrig fredag venter østjyderne",http://tv2oj-juan2015.develop.fynskemedier.dk/artikel/281795:oestjylland--TOer-og-solrig-fredag-venter-Oestjyderne
"8900 Randers C","Danmarks klogeste klasse skal findes",http://tv2oj-juan2015.develop.fynskemedier.dk/artikel/281807:Randers--Danmarks-klogeste-klasse-skal-findes
"8700 Horsens","Årets Unge Erhvervsleder er kåret",http://tv2oj-juan2015.develop.fynskemedier.dk/artikel/281808:Horsens---rets-Unge-Erhvervsleder-er-k-ret
"8210 Aarhus V","Aarhus-drenge bliver iværksættere",http://tv2oj-juan2015.develop.fynskemedier.dk/artikel/281810:Aarhus--Aarhus-drenge-bliver-ivaerksaettere
"8500 Grenaa","Bigballer: Beredskabet arbejder på tolvte time med brand",http://tv2oj-juan2015.develop.fynskemedier.dk/artikel/281815:Norddjurs--Bigballer--Beredskabet-arbejder-p--tolvte-time-med-brand
"8543 Hornslet","Fodboldfritid som alternativ til SFO",http://tv2oj-juan2015.develop.fynskemedier.dk/artikel/281819:oestjylland--Fodboldfritid-som-alternativ-til-SFO
"8362 Hørning","Fodboldfritid som alternativ til SFO",http://tv2oj-juan2015.develop.fynskemedier.dk/artikel/281819:oestjylland--Fodboldfritid-som-alternativ-til-SFO
"8300 Odder","Fodboldfritid som alternativ til SFO",http://tv2oj-juan2015.develop.fynskemedier.dk/artikel/281819:oestjylland--Fodboldfritid-som-alternativ-til-SFO
"8000 Aarhus c","Fodboldfritid som alternativ til SFO",http://tv2oj-juan2015.develop.fynskemedier.dk/artikel/281819:oestjylland--Fodboldfritid-som-alternativ-til-SFO
"8000 Aarhus c","Teaterstykke er inspireret af borgerprotester",http://tv2oj-juan2015.develop.fynskemedier.dk/artikel/281824:Aarhus--Teaterstykke-er-inspireret-af-borgerprotester
"8500 Grenaa","Indsatsleder: Strålevarmen var for voldsom",http://tv2oj-juan2015.develop.fynskemedier.dk/artikel/281832:Norddjurs--Indsatsleder--Str-levarmen-var-for-voldsom
"8000 Aarhus c","Virksomheder på Djursland står sammen ",http://tv2oj-juan2015.develop.fynskemedier.dk/artikel/281839:Syddjurs--Virksomheder-p--Djursland-st-r-sammen
"8000 Aarhus c","Parkerende bilist kørte ind i cyklist i Aarhus",http://tv2oj-juan2015.develop.fynskemedier.dk/artikel/281846:Aarhus--Parkerende-bilist-kOerte-ind-i-cyklist-i-Aarhus
"8000 Aarhus c","Aarhus får landets første fodboldmuseum",http://tv2oj-juan2015.develop.fynskemedier.dk/artikel/281850:Aarhus--Aarhus-f-r-landets-fOerste-fodboldmuseum
"8000 Aarhus c","Mand angreb diskotek med stinkbombe ",http://tv2oj-juan2015.develop.fynskemedier.dk/artikel/281861:Aarhus--Mand-angreb-diskotek-med-stinkbombe
"8410 Rønde","EM i hundeslædeløb ved Kalø ",http://tv2oj-juan2015.develop.fynskemedier.dk/artikel/281865:Syddjurs--EM-i-hundeslaedelOeb-ved-KalOe
"8900 Randers C","Gurli skal på scenen foran 500 tilskuere ",http://tv2oj-juan2015.develop.fynskemedier.dk/artikel/281877:Randers--Gurli-skal-p--scenen-foran-500-tilskuere
"8500 Grenaa","Østjyde tiltalt: Gav afghanere et lift til Grenaa",http://tv2oj-juan2015.develop.fynskemedier.dk/artikel/281878:oestjylland--oestjyde-tiltalt--Gav-afghanere-et-lift-til-Grenaa
"8900 Randers C","Forsinkelser: Togskinner skiftes ud",http://tv2oj-juan2015.develop.fynskemedier.dk/artikel/281885:Randers--Forsinkelser--Togskinner-skiftes-ud
"8000 Aarhus c","Forsinkelser: Togskinner skiftes ud",http://tv2oj-juan2015.develop.fynskemedier.dk/artikel/281885:Randers--Forsinkelser--Togskinner-skiftes-ud
"8300 Odder","Ingen motor er for lille eller stor for Ib",http://tv2oj-juan2015.develop.fynskemedier.dk/artikel/281887:Odder--Ingen-motor-er-for-lille-eller-stor-for-Ib
"8600 Silkeborg","Tre biler kørt sammen i Silkeborg",http://tv2oj-juan2015.develop.fynskemedier.dk/artikel/281892:Silkeborg--Tre-biler-kOert-sammen-i-Silkeborg
"8000 Aarhus c","Aarhusianske mænd dømt for afpresning",http://tv2oj-juan2015.develop.fynskemedier.dk/artikel/281897:Aarhus--Aarhusianske-maend-dOemt-for-afpresning
"8000 Aarhus c","Rådmand klar med Aarhus-julekalender",http://tv2oj-juan2015.develop.fynskemedier.dk/artikel/281900:Aarhus--R-dmand-klar-med-Aarhus-julekalender
"8500 Grenaa","Bigballer brænder ud: Folk ringer stadig 112 om branden ",http://tv2oj-juan2015.develop.fynskemedier.dk/artikel/281901:Norddjurs--Bigballer-braender-ud--Folk-ringer-stadig-112-om-branden
Ingenting,"Kold weekend: Nattefrosten rammer Østjylland",http://tv2oj-juan2015.develop.fynskemedier.dk/artikel/281903:oestjylland--Kold-weekend--Nattefrosten-rammer-oestjylland
"8000 Aarhus c","Ambassadør efter terror: Vi kan lære af Aarhus",http://tv2oj-juan2015.develop.fynskemedier.dk/artikel/281909:Aarhus--AmbassadOer-efter-terror--Vi-kan-laere-af-Aarhus
"8240 Risskov","Denne Porsche er lige blevet 330.000 kr. billigere",http://tv2oj-juan2015.develop.fynskemedier.dk/artikel/281913:oestjylland--Denne-Porsche-er-lige-blevet-330-000-kr--billigere
"8600 Silkeborg","Bilforhandlere: Ændret afgift uden betydning",http://tv2oj-juan2015.develop.fynskemedier.dk/artikel/281914:Silkeborg--Bilforhandlere--AEndret-afgift-uden-betydning
"8000 Aarhus c","Aarhus-sejlere i modvind inden finalen ",http://tv2oj-juan2015.develop.fynskemedier.dk/artikel/281945:Aarhus--Aarhus-sejlere-i-modvind-inden-finalen
Ingenting,"Ingen ulveskove i Midtjylland",http://tv2oj-juan2015.develop.fynskemedier.dk/artikel/281948:oestjylland--Ingen-ulveskove-i-Midtjylland
"8600 Silkeborg","Debuterede i EHF Cuppen med storsejr",http://tv2oj-juan2015.develop.fynskemedier.dk/artikel/281951:Silkeborg--Debuterede-i-EHF-Cuppen-med-storsejr
"8000 Aarhus c","Nyt pasningstilbud bliver konkurrent til SFO",http://tv2oj-juan2015.develop.fynskemedier.dk/artikel/281957:oestjylland--Nyt-pasningstilbud-bliver-konkurrent-til-SFO
"Intet postnummer"," Europol hjalp i østjysk kokainsag",http://tv2oj-juan2015.develop.fynskemedier.dk/artikel/281959:oestjylland---Europol-hjalp-i-Oestjysk-kokainsag
"8660 Skanderborg","Åbent hus på Skanderborg Fælled i dag",http://tv2oj-juan2015.develop.fynskemedier.dk/artikel/281960:Skanderborg---bent-hus-p--Skanderborg-Faelled-i-dag
"8700 Horsens","Horsens-elever vandt opfinderpris",http://tv2oj-juan2015.develop.fynskemedier.dk/artikel/281965:Horsens--Horsens-elever-vandt-opfinderpris
"8000 Aarhus c","VM-løber håber at blive årets sportsnavn",http://tv2oj-juan2015.develop.fynskemedier.dk/artikel/281971:Aarhus--VM-lOeber-h-ber-at-blive--rets-sportsnavn
"8240 Risskov","Cheerleadere deltager i stort julestævne ",http://tv2oj-juan2015.develop.fynskemedier.dk/artikel/281979:Aarhus--Cheerleadere-deltager-i-stort-julestaevne
"8600 Silkeborg","Forældre har indsamlet 10.000 underskrifter mod skolestruktur ",http://tv2oj-juan2015.develop.fynskemedier.dk/artikel/281981:Silkeborg--Foraeldre-har-indsamlet-10-000-underskrifter-mod-skolestruktur
Ingenting,"Solveig kæmper med senfølger af overgreb i barndommen",http://tv2oj-juan2015.develop.fynskemedier.dk/artikel/281984:Syddjurs--Solveig-kaemper-med-senfOelger-af-overgreb-i-barndommen
"8000 Aarhus c","Brøndbytræner skamroser AGF-træner ",http://tv2oj-juan2015.develop.fynskemedier.dk/artikel/281985:Aarhus--BrOendbytraener-skamroser-AGF-traener
"8660 Skanderborg","Stor interesse for multibygning: Det er større, end jeg troede",http://tv2oj-juan2015.develop.fynskemedier.dk/artikel/281992:Skanderborg--Stor-interesse-for-multibygning--Det-er-stOerre--end-jeg-troede
"8000 Aarhus c"," Røde roser for at markere midtvejsvalg",http://tv2oj-juan2015.develop.fynskemedier.dk/artikel/281993:Aarhus---ROede-roser-for-at-markere-midtvejsvalg
Ingenting,"DMI om sne-varsel: Østjyderne skal ikke finde kælken frem ",http://tv2oj-juan2015.develop.fynskemedier.dk/artikel/281994:oestjylland--DMI-om-sne-varsel--oestjyderne-skal-ikke-finde-kaelken-frem
"8660 Skanderborg","Skanderborg kan ikke hvile på laurbærrene",http://tv2oj-juan2015.develop.fynskemedier.dk/artikel/282000:Skanderborg--Skanderborg-kan-ikke-hvile-p--laurbaerrene
"8600 Silkeborg","Silkeborg-Voel sikkert videre i EHF Cup ",http://tv2oj-juan2015.develop.fynskemedier.dk/artikel/282001:Silkeborg--Silkeborg-Voel-sikkert-videre-i-EHF-Cup
"8660 Skanderborg","Valget i 2013: Sikkert genvalg til Gaarde ",http://tv2oj-juan2015.develop.fynskemedier.dk/artikel/282006:Skanderborg--Valget-i-2013--Sikkert-genvalg-til-Gaarde
"8000 Aarhus c","Design-tyv anholdt efter flere indbrud",http://tv2oj-juan2015.develop.fynskemedier.dk/artikel/282009:Aarhus--Design-tyv-anholdt-efter-flere-indbrud
"8600 Silkeborg","Efter storsejr: Der var niveau til forskel ",http://tv2oj-juan2015.develop.fynskemedier.dk/artikel/282010:Silkeborg--Efter-storsejr--Der-var-niveau-til-forskel
"8660 Skanderborg","Midtvejsvalg i Skanderborg: Status quo i rød og blå blok ",http://tv2oj-juan2015.develop.fynskemedier.dk/artikel/282017:Skanderborg--Midtvejsvalg-i-Skanderborg--Status-quo-i-rOed-og-bl--blok
"8305 Samsø","Aflyser færge på grund af kraftig vind ",http://tv2oj-juan2015.develop.fynskemedier.dk/artikel/282025:SamsOe--Aflyser-faerge-p--grund-af-kraftig-vind
Ingenting,"Ny østjysk prognose: Her kan der falde et par centimeter sne ",http://tv2oj-juan2015.develop.fynskemedier.dk/artikel/282028:oestjylland--Ny-Oestjysk-prognose--Her-kan-der-falde-et-par-centimeter-sne
"8500 Grenaa","Netværksmøde midt i Aarhus Lufthavn ",http://tv2oj-juan2015.develop.fynskemedier.dk/artikel/282029:Syddjurs--NetvaerksmOede-midt-i-Aarhus-Lufthavn
"8000 Aarhus c","Netværksmøde midt i Aarhus Lufthavn ",http://tv2oj-juan2015.develop.fynskemedier.dk/artikel/282029:Syddjurs--NetvaerksmOede-midt-i-Aarhus-Lufthavn
"8660 Skanderborg","Borgmester: Nyt hus sparer os for millioner",http://tv2oj-juan2015.develop.fynskemedier.dk/artikel/282030:oestjylland--Borgmester--Nyt-hus-sparer-os-for-millioner
"8000 Aarhus c","Aarhusianske sejlere vinder VM-bronze i Argentina",http://tv2oj-juan2015.develop.fynskemedier.dk/artikel/282045:Aarhus--Aarhusianske-sejlere-vinder-VM-bronze-i-Argentina
"8400 Ebeltoft","Falck opfordrer til at køre forsigtigt og efter forholdene",http://tv2oj-juan2015.develop.fynskemedier.dk/artikel/282065:oestjylland--Falck-opfordrer-til-at-kOere-forsigtigt-og-efter-forholdene
"8600 Silkeborg","Falck opfordrer til at køre forsigtigt og efter forholdene",http://tv2oj-juan2015.develop.fynskemedier.dk/artikel/282065:oestjylland--Falck-opfordrer-til-at-kOere-forsigtigt-og-efter-forholdene
"8000 Aarhus c","Falck opfordrer til at køre forsigtigt og efter forholdene",http://tv2oj-juan2015.develop.fynskemedier.dk/artikel/282065:oestjylland--Falck-opfordrer-til-at-kOere-forsigtigt-og-efter-forholdene
Ingenting,"DSB forudser forsinkelser hele søndag",http://tv2oj-juan2015.develop.fynskemedier.dk/artikel/282069:oestjylland--DSB-forudser-forsinkelser-hele-sOendag
"8900 Randers C","Randers HK videre i EHF Cuppen",http://tv2oj-juan2015.develop.fynskemedier.dk/artikel/282070:Randers--Randers-HK-videre-i-EHF-Cuppen
"8370 Hadsten","Isglatte veje på E45 og på Djursland",http://tv2oj-juan2015.develop.fynskemedier.dk/artikel/282078:oestjylland--Isglatte-veje-p--E45-og-p--Djursland
"8200 Aarhus N","Isglatte veje på E45 og på Djursland",http://tv2oj-juan2015.develop.fynskemedier.dk/artikel/282078:oestjylland--Isglatte-veje-p--E45-og-p--Djursland
"8500 Grenaa","Kattegatcentret aflyser julemarked",http://tv2oj-juan2015.develop.fynskemedier.dk/artikel/282079:Norddjurs--Kattegatcentret-aflyser-julemarked
"8400 Ebeltoft","Mols ramt af fygesne fra morgenstunden",http://tv2oj-juan2015.develop.fynskemedier.dk/artikel/282083:oestjylland--Mols-ramt-af-fygesne-fra-morgenstunden
"8000 Aarhus c","AGF: Kampen afvikles med varme i banen",http://tv2oj-juan2015.develop.fynskemedier.dk/artikel/282085:Aarhus--AGF--Kampen-afvikles-med-varme-i-banen
"8500 Grenaa","Færge aflyst på grund af pram-sammenstød ",http://tv2oj-juan2015.develop.fynskemedier.dk/artikel/282090:Norddjurs--Faerge-aflyst-p--grund-af-pram-sammenstOed
"8700 Horsens","Sne udsætter SIFs kamp mod Horsens",http://tv2oj-juan2015.develop.fynskemedier.dk/artikel/282093:Silkeborg--Sne-udsaetter-SIFs-kamp-mod-Horsens
"8210 Aarhus V","Flere uheld: Biler i grøften og lastbiler bremses af bakker ",http://tv2oj-juan2015.develop.fynskemedier.dk/artikel/282097:oestjylland--Flere-uheld--Biler-i-grOeften-og-lastbiler-bremses-af-bakker
"8900 Randers C","Galleri: Snemænd, kolde poter og barnlig glæde på en søndag",http://tv2oj-juan2015.develop.fynskemedier.dk/artikel/282104:oestjylland--Galleri--Snemaend--kolde-poter-og-barnlig-glaede-p--en-sOendag
"8600 Silkeborg","Galleri: Snemænd, kolde poter og barnlig glæde på en søndag",http://tv2oj-juan2015.develop.fynskemedier.dk/artikel/282104:oestjylland--Galleri--Snemaend--kolde-poter-og-barnlig-glaede-p--en-sOendag
"8000 Aarhus c","Galleri: Snemænd, kolde poter og barnlig glæde på en søndag",http://tv2oj-juan2015.develop.fynskemedier.dk/artikel/282104:oestjylland--Galleri--Snemaend--kolde-poter-og-barnlig-glaede-p--en-sOendag
"8700 Horsens","Galleri: Snemænd, kolde poter og barnlig glæde på en søndag",http://tv2oj-juan2015.develop.fynskemedier.dk/artikel/282104:oestjylland--Galleri--Snemaend--kolde-poter-og-barnlig-glaede-p--en-sOendag
"8000 Aarhus c","DSB indkalder reserve-lokoførere",http://tv2oj-juan2015.develop.fynskemedier.dk/artikel/282107:Aarhus--DSB-indkalder-reserve-lokofOerere
"8000 Aarhus c","Bilister uden vinterdæk blev skubbet i gang ",http://tv2oj-juan2015.develop.fynskemedier.dk/artikel/282109:Aarhus--Bilister-uden-vinterdaek-blev-skubbet-i-gang
"8500 Grenaa","Slæbebåd skal frigøre Stena Line fra pram",http://tv2oj-juan2015.develop.fynskemedier.dk/artikel/282112:Norddjurs--Slaebeb-d-skal-frigOere-Stena-Line-fra-pram
"8000 Aarhus c","LIVE: AGF udligner til 1-1 efter selvmål",http://tv2oj-juan2015.develop.fynskemedier.dk/artikel/282115:Aarhus--LIVE--AGF-udligner-til-1-1-efter-selvm-l
"8660 Skanderborg","Gaarde er en vellidt herre i Skanderborg",http://tv2oj-juan2015.develop.fynskemedier.dk/artikel/282121:Skanderborg--Gaarde-er-en-vellidt-herre-i-Skanderborg
"8000 Aarhus c","Fodboldmuseum skal tiltrække gamle som unge",http://tv2oj-juan2015.develop.fynskemedier.dk/artikel/282124:Aarhus--Fodboldmuseum-skal-tiltraekke-gamle-som-unge
"8260 Viby J","Datter blev dræbt i Syrien: Jeg har mistet en dejlig pige",http://tv2oj-juan2015.develop.fynskemedier.dk/artikel/282128:Aarhus--Datter-blev-draebt-i-Syrien--Jeg-har-mistet-en-dejlig-pige
"8500 Grenaa","Stena Line: Vi håber at kunne sejle igen i nat",http://tv2oj-juan2015.develop.fynskemedier.dk/artikel/282135:Norddjurs--Stena-Line--Vi-h-ber-at-kunne-sejle-igen-i-nat
"8000 Aarhus c","Bundsgaard: Vi kan ikke gøre det alene ",http://tv2oj-juan2015.develop.fynskemedier.dk/artikel/282139:Aarhus--Bundsgaard--Vi-kan-ikke-gOere-det-alene
"8660 Skanderborg","Formand for varmeværk raser: Hvorfor må vi ikke udvide?",http://tv2oj-juan2015.develop.fynskemedier.dk/artikel/282144:Skanderborg--Formand-for-varmevaerk-raser--Hvorfor-m--vi-ikke-udvide
"8000 Aarhus c","AGF spillede uafgjort efter træls selvmål",http://tv2oj-juan2015.develop.fynskemedier.dk/artikel/282146:Aarhus--AGF-spillede-uafgjort-efter-traels-selvm-l
"8000 Aarhus c","AGF-spillere: Vi fik presset Brøndby i dag ",http://tv2oj-juan2015.develop.fynskemedier.dk/artikel/282149:Aarhus--AGF-spillere--Vi-fik-presset-BrOendby-i-dag
"8300 Odder","Odder Roklub hædret for miljøprojekt",http://tv2oj-juan2015.develop.fynskemedier.dk/artikel/282181:Odder--Odder-Roklub-haedret-for-miljOeprojekt
"8000 Aarhus c","Sneglatte veje venter østjyderne i morgentrafikken",http://tv2oj-juan2015.develop.fynskemedier.dk/artikel/282184:oestjylland--Sneglatte-veje-venter-Oestjyderne-i-morgentrafikken
"8500 Grenaa","Kattegatcentret får millioner til fiskeprojekt",http://tv2oj-juan2015.develop.fynskemedier.dk/artikel/282187:Norddjurs--Kattegatcentret-f-r-millioner-til-fiskeprojekt
"8900 Randers C","Gudenåen gik over sine bredder",http://tv2oj-juan2015.develop.fynskemedier.dk/artikel/282190:Randers--Guden-en-gik-over-sine-bredder
"8000 Aarhus c","Aarhus 2017 støtter 39 kulturprojekter",http://tv2oj-juan2015.develop.fynskemedier.dk/artikel/282193:oestjylland--Aarhus-2017-stOetter-39-kulturprojekter
"8230 Åbyhøj","Lars Larsen bliver hovedsponsor for Red Barnet",http://tv2oj-juan2015.develop.fynskemedier.dk/artikel/282196:Silkeborg--Lars-Larsen-bliver-hovedsponsor-for-Red-Barnet
