"8900 Randers C","Pædofilitiltalt gemte sminke og parykker",http://tv2oj-juan2015.develop.fynskemedier.dk/artikel/285893:Randers--Paedofilitiltalt-gemte-sminke-og-parykker
"8600 Silkeborg","Nørgaard forlænger med Silkeborg IF",http://tv2oj-juan2015.develop.fynskemedier.dk/artikel/285895:Silkeborg--NOergaard-forlaenger-med-Silkeborg-IF
"8305 Samsø","Borgmester afviser: Ingen handicappede skal tvangsflyttes ",http://tv2oj-juan2015.develop.fynskemedier.dk/artikel/285899:SamsOe--Borgmester-afviser--Ingen-handicappede-skal-tvangsflyttes
"8600 Silkeborg","Målvogter bliver i Silkeborg-Voel",http://tv2oj-juan2015.develop.fynskemedier.dk/artikel/285900:Silkeborg--M-lvogter-bliver-i-Silkeborg-Voel
"8000 Aarhus c","27-årig skal for retten efter slagsmål ",http://tv2oj-juan2015.develop.fynskemedier.dk/artikel/285909:Aarhus--27--rig-skal-for-retten-efter-slagsm-l
"8200 Aarhus N","Brand i forenings-lokaler i Aarhus",http://tv2oj-juan2015.develop.fynskemedier.dk/artikel/285911:Aarhus--Brand-i-forenings-lokaler-i-Aarhus
"8000 Aarhus c","Dickow og Brandt giver ekstrakoncert",http://tv2oj-juan2015.develop.fynskemedier.dk/artikel/285912:Aarhus--Dickow-og-Brandt-giver-ekstrakoncert
"8000 Aarhus c","Gave glemt i bussen: Treårige Elias har fået sin julegave tilbage",http://tv2oj-juan2015.develop.fynskemedier.dk/artikel/285916:Aarhus--Gave-glemt-i-bussen--Tre-rige-Elias-har-f-et-sin-julegave-tilbage
"8000 Aarhus c","Rotterne stortrives i Aarhus",http://tv2oj-juan2015.develop.fynskemedier.dk/artikel/285918:Aarhus--Rotterne-stortrives-i-Aarhus
"8660 Skanderborg","Opdateret: E45 genåbnet efter uheld ",http://tv2oj-juan2015.develop.fynskemedier.dk/artikel/285920:Skanderborg--Opdateret--E45-gen-bnet-efter-uheld
"Intet postnummer","Julen bliver ikke hvid i Østjylland",http://tv2oj-juan2015.develop.fynskemedier.dk/artikel/285928:oestjylland--Julen-bliver-ikke-hvid-i-oestjylland
"8660 Skanderborg","Bydelsmødre hjælper andre kvinder",http://tv2oj-juan2015.develop.fynskemedier.dk/artikel/285932:Skanderborg--BydelsmOedre-hjaelper-andre-kvinder
"8900 Randers C","Lægefamilie har fået afslag på asylansøgning",http://tv2oj-juan2015.develop.fynskemedier.dk/artikel/285937:Randers--Laegefamilie-har-f-et-afslag-p--asylansOegning
"8000 Aarhus c","Er det DKs bedste bøfsandwich?",http://tv2oj-juan2015.develop.fynskemedier.dk/artikel/285943:Aarhus--Er-det-DKs-bedste-bOefsandwich
"8900 Randers C","Vinni Stenholt fra Randers blev Årets Østjyde 2015",http://tv2oj-juan2015.develop.fynskemedier.dk/artikel/286050:Randers--Vinni-Stenholt-fra-Randers-blev--rets-oestjyde-2015
"8200 Aarhus N","Årets Østjyde: Se finalen fra Ørsted Kro her",http://tv2oj-juan2015.develop.fynskemedier.dk/artikel/286051:oestjylland---rets-oestjyde--Se-finalen-fra-oersted-Kro-her
"Intet postnummer","tv2oj.dk kører igen - ramt af nedbrud lørdag",http://tv2oj-juan2015.develop.fynskemedier.dk/artikel/286052:oestjylland--tv2oj-dk-kOerer-igen---ramt-af-nedbrud-lOerdag
"8305 Samsø","Hurtigfærge til Samsø rykker nærmere",http://tv2oj-juan2015.develop.fynskemedier.dk/artikel/286053:SamsOe--Hurtigfaerge-til-SamsOe-rykker-naermere
"8850 Bjerringbro","BSV fik aldrig styr på Skjern i topkamp",http://tv2oj-juan2015.develop.fynskemedier.dk/artikel/286055:Silkeborg--BSV-fik-aldrig-styr-p--Skjern-i-topkamp
"8210 Aarhus V","23-årig mand anholdt efter knivstik",http://tv2oj-juan2015.develop.fynskemedier.dk/artikel/286056:Aarhus--23--rig-mand-anholdt-efter-knivstik
"8240 Risskov","Jessica fra Risskov deltog i Miss World: Vi er stolte af hende ",http://tv2oj-juan2015.develop.fynskemedier.dk/artikel/286057:Aarhus--Jessica-fra-Risskov-deltog-i-Miss-World--Vi-er-stolte-af-hende
"8000 Aarhus c","Botanisk Have fredet: Rådmand vil anke afgørelsen",http://tv2oj-juan2015.develop.fynskemedier.dk/artikel/286059:Aarhus--Botanisk-Have-fredet--R-dmand-vil-anke-afgOerelsen
"8900 Randers C","Årets Østjyde: Nu vil jeg hjælpe de raske søskende",http://tv2oj-juan2015.develop.fynskemedier.dk/artikel/286062:Randers---rets-oestjyde--Nu-vil-jeg-hjaelpe-de-raske-sOeskende
"8543 Hornslet","Bodega-vold: Mænd slået ned med ølglas",http://tv2oj-juan2015.develop.fynskemedier.dk/artikel/286063:oestjylland--Bodega-vold--Maend-sl-et-ned-med-Oelglas
"8000 Aarhus c","Busser kører i pendulfart med julegæster ",http://tv2oj-juan2015.develop.fynskemedier.dk/artikel/286066:Aarhus--Busser-kOerer-i-pendulfart-med-julegaester
"8320 Mårslet","En juleferie med astronomi og rum-gåder ",http://tv2oj-juan2015.develop.fynskemedier.dk/artikel/286069:Aarhus--En-juleferie-med-astronomi-og-rum-g-der
"Intet postnummer","Det lune vejr ser ud til at fortsætte",http://tv2oj-juan2015.develop.fynskemedier.dk/artikel/286071:oestjylland--Det-lune-vejr-ser-ud-til-at-fortsaette
"8660 Skanderborg","Skanderborg-drama i Bette Balkan",http://tv2oj-juan2015.develop.fynskemedier.dk/artikel/286072:Skanderborg--Skanderborg-drama-i-Bette-Balkan
"8000 Aarhus c","18-årig mand blev frarøvet sin telefon ",http://tv2oj-juan2015.develop.fynskemedier.dk/artikel/286073:Aarhus--18--rig-mand-blev-frarOevet-sin-telefon
"8850 Bjerringbro","BSV-træner: Skjern var en tand skarpere",http://tv2oj-juan2015.develop.fynskemedier.dk/artikel/286074:Silkeborg--BSV-traener--Skjern-var-en-tand-skarpere
"8900 Randers C","Biografdirektør: Det her er mændenes Fifty Shades of Grey",http://tv2oj-juan2015.develop.fynskemedier.dk/artikel/286079:oestjylland--BiografdirektOer--Det-her-er-maendenes-Fifty-Shades-of-Grey
"8600 Silkeborg","Biografdirektør: Det her er mændenes Fifty Shades of Grey",http://tv2oj-juan2015.develop.fynskemedier.dk/artikel/286079:oestjylland--BiografdirektOer--Det-her-er-maendenes-Fifty-Shades-of-Grey
"8000 Aarhus c","Foreninger får igen i år glæde af togpenge ",http://tv2oj-juan2015.develop.fynskemedier.dk/artikel/286086:Aarhus--Foreninger-f-r-igen-i--r-glaede-af-togpenge
"8382 Hinnerup","Byrådsmedlem: Nu har vi altså gravet nok",http://tv2oj-juan2015.develop.fynskemedier.dk/artikel/286088:Favrskov--Byr-dsmedlem--Nu-har-vi-alts--gravet-nok
"8520 Lystrup","Tyv og beboer kæmpede om standerlampe ",http://tv2oj-juan2015.develop.fynskemedier.dk/artikel/286090:Aarhus--Tyv-og-beboer-kaempede-om-standerlampe
"8000 Aarhus c","Julemad, tøj og ny frisure: Hjemløse fik en god dag i Aarhus ",http://tv2oj-juan2015.develop.fynskemedier.dk/artikel/286092:Aarhus--Julemad--tOej-og-ny-frisure--HjemlOese-fik-en-god-dag-i-Aarhus
"8305 Samsø","Attraktioner ser muligheder i hurtigfærge",http://tv2oj-juan2015.develop.fynskemedier.dk/artikel/286094:SamsOe--Attraktioner-ser-muligheder-i-hurtigfaerge
"8000 Aarhus c","Optimisme: Julehandel slår alle rekorder ",http://tv2oj-juan2015.develop.fynskemedier.dk/artikel/286100:Aarhus--Optimisme--Julehandel-sl-r-alle-rekorder
"8900 Randers C","Ung sangerinde: Nervepirrende men sjovt at optræde på live-tv",http://tv2oj-juan2015.develop.fynskemedier.dk/artikel/286101:Randers--Ung-sangerinde--Nervepirrende-men-sjovt-at-optraede-p--live-tv
"8000 Aarhus c","Bød trængte familier på julemiddag",http://tv2oj-juan2015.develop.fynskemedier.dk/artikel/286106:Aarhus--BOed-traengte-familier-p--julemiddag
"8660 Skanderborg","Politi eftersøger svagtseende mand fra Skanderborg",http://tv2oj-juan2015.develop.fynskemedier.dk/artikel/286110:Skanderborg--Politi-eftersOeger-svagtseende-mand-fra-Skanderborg
"8000 Aarhus c","Kommunen vil nu udvikle Sydhavnen",http://tv2oj-juan2015.develop.fynskemedier.dk/artikel/286114:Aarhus--Kommunen-vil-nu-udvikle-Sydhavnen
"8700 Horsens","Fik hurtigt styr på brand i kælder",http://tv2oj-juan2015.develop.fynskemedier.dk/artikel/286120:Horsens--Fik-hurtigt-styr-p--brand-i-kaelder
"Intet postnummer","Det milde vejr har sat sine spor i Østjylland",http://tv2oj-juan2015.develop.fynskemedier.dk/artikel/286122:oestjylland--Det-milde-vejr-har-sat-sine-spor-i-oestjylland
"8000 Aarhus c","Julefrokoster giver travlhed i nattelivet",http://tv2oj-juan2015.develop.fynskemedier.dk/artikel/286124:Aarhus--Julefrokoster-giver-travlhed-i-nattelivet
"8000 Aarhus c","Aarhus dropper at fjerne tyggegummi",http://tv2oj-juan2015.develop.fynskemedier.dk/artikel/286153:Aarhus--Aarhus-dropper-at-fjerne-tyggegummi
"8700 Horsens","Private betaler udgravninger for museer",http://tv2oj-juan2015.develop.fynskemedier.dk/artikel/286155:Horsens--Private-betaler-udgravninger-for-museer
"8600 Silkeborg","Endnu en profil forlænger med Silkeborg-Voel",http://tv2oj-juan2015.develop.fynskemedier.dk/artikel/286157:Silkeborg--Endnu-en-profil-forlaenger-med-Silkeborg-Voel
"8660 Skanderborg","Brand hærgede landejendom i Tebstrup ",http://tv2oj-juan2015.develop.fynskemedier.dk/artikel/286160:Skanderborg--Brand-haergede-landejendom-i-Tebstrup
"Intet postnummer","Bupl: Vuggestuebørn sendes i børnehave for tidligt",http://tv2oj-juan2015.develop.fynskemedier.dk/artikel/286163:oestjylland--Bupl--VuggestuebOern-sendes-i-bOernehave-for-tidligt
"8660 Skanderborg","Politiet søger med hunde efter 75-årig ",http://tv2oj-juan2015.develop.fynskemedier.dk/artikel/286166:Skanderborg--Politiet-sOeger-med-hunde-efter-75--rig
"8000 Aarhus c","Bears henter amerikansk power forward",http://tv2oj-juan2015.develop.fynskemedier.dk/artikel/286167:Aarhus--Bears-henter-amerikansk-power-forward
"8900 Randers C","Kommune laver postkasse til bekymringer",http://tv2oj-juan2015.develop.fynskemedier.dk/artikel/286176:Randers--Kommune-laver-postkasse-til-bekymringer
"8000 Aarhus c","Et halvt år med Dokk1: Folk strømmer til ",http://tv2oj-juan2015.develop.fynskemedier.dk/artikel/286179:Aarhus--Et-halvt--r-med-Dokk1--Folk-strOemmer-til
"8000 Aarhus c","Cult-direktør følte sig forfulgt af Skat, men får nu skattesmæk",http://tv2oj-juan2015.develop.fynskemedier.dk/artikel/286182:Aarhus--Cult-direktOer-fOelte-sig-forfulgt-af-Skat--men-f-r-nu-skattesmaek
"8000 Aarhus c","Tre mænd anholdt efter indbrud",http://tv2oj-juan2015.develop.fynskemedier.dk/artikel/286195:Aarhus--Tre-maend-anholdt-efter-indbrud
"Intet postnummer","Venstre klar med håndsrækning til kongelige kroer",http://tv2oj-juan2015.develop.fynskemedier.dk/artikel/286200:oestjylland--Venstre-klar-med-h-ndsraekning-til-kongelige-kroer
"8410 Rønde","Syddjurs satser stort med nyt byggeri i Rønde",http://tv2oj-juan2015.develop.fynskemedier.dk/artikel/286203:Syddjurs--Syddjurs-satser-stort-med-nyt-byggeri-i-ROende
"Intet postnummer","Smadrede ruder og ridsede tage: Stormen 'Gorm' koster dyrt",http://tv2oj-juan2015.develop.fynskemedier.dk/artikel/286205:oestjylland--Smadrede-ruder-og-ridsede-tage--Stormen--Gorm--koster-dyrt
"8700 Horsens","Horsens-sejler nomineret til sportspris",http://tv2oj-juan2015.develop.fynskemedier.dk/artikel/286207:Horsens--Horsens-sejler-nomineret-til-sportspris
"8000 Aarhus c","Aarsleff præsenterer flot regnskab",http://tv2oj-juan2015.develop.fynskemedier.dk/artikel/286211:Aarhus--Aarsleff-praesenterer-flot-regnskab
"8000 Aarhus c","Busser kører i pendulfart med julegæster",http://tv2oj-juan2015.develop.fynskemedier.dk/artikel/286215:Aarhus--Busser-kOerer-i-pendulfart-med-julegaester
"Intet postnummer","Fyrværkeri-ulykke: Retssag til februar",http://tv2oj-juan2015.develop.fynskemedier.dk/artikel/286228:oestjylland--Fyrvaerkeri-ulykke--Retssag-til-februar
"8000 Aarhus c","Dennis Ceylan hovednavn ved stævne i Aarhus",http://tv2oj-juan2015.develop.fynskemedier.dk/artikel/286243:Aarhus--Dennis-Ceylan-hovednavn-ved-staevne-i-Aarhus
"8000 Aarhus c","Tyveri: Evald Krog beder om hjælp til at finde sin handicapbil",http://tv2oj-juan2015.develop.fynskemedier.dk/artikel/286246:Aarhus--Tyveri--Evald-Krog-beder-om-hjaelp-til-at-finde-sin-handicapbil
"Intet postnummer","60 børn mangler stadig julehjælp",http://tv2oj-juan2015.develop.fynskemedier.dk/artikel/286250:oestjylland--60-bOern-mangler-stadig-julehjaelp
"8660 Skanderborg","Overvægtsklinik skal hjælpe børn og unge",http://tv2oj-juan2015.develop.fynskemedier.dk/artikel/286253:Skanderborg--Overvaegtsklinik-skal-hjaelpe-bOern-og-unge
"8600 Silkeborg","Skolestruktur i Silkeborg bliver udsat et år",http://tv2oj-juan2015.develop.fynskemedier.dk/artikel/286256:Silkeborg--Skolestruktur-i-Silkeborg-bliver-udsat-et--r
"8220 Brabrand","Veteranhjem: Så blev dørene endelig åbnet til det nye frirum",http://tv2oj-juan2015.develop.fynskemedier.dk/artikel/286262:Aarhus--Veteranhjem--S--blev-dOerene-endelig--bnet-til-det-nye-frirum
"8000 Aarhus c","Rekordmange afslag: Nu samler private også ind til julehjælp",http://tv2oj-juan2015.develop.fynskemedier.dk/artikel/286266:Aarhus--Rekordmange-afslag--Nu-samler-private-ogs--ind-til-julehjaelp
"8600 Silkeborg","Silkeborg kan købe torvet for nul kroner",http://tv2oj-juan2015.develop.fynskemedier.dk/artikel/286267:Silkeborg--Silkeborg-kan-kOebe-torvet-for-nul-kroner
"Intet postnummer","Folketinget giver kroejere medvind",http://tv2oj-juan2015.develop.fynskemedier.dk/artikel/286271:oestjylland--Folketinget-giver-kroejere-medvind
"Intet postnummer","Udsigt til grå og regnfulde juledage",http://tv2oj-juan2015.develop.fynskemedier.dk/artikel/286277:oestjylland--Udsigt-til-gr--og-regnfulde-juledage
"8000 Aarhus c","Århus Håndbold vandt udekamp ",http://tv2oj-juan2015.develop.fynskemedier.dk/artikel/286278:Aarhus---rhus-H-ndbold-vandt-udekamp
"8410 Rønde","75-årig mand fundet druknet ved Kaløvig",http://tv2oj-juan2015.develop.fynskemedier.dk/artikel/286299:Skanderborg--75--rig-mand-fundet-druknet-ved-KalOevig
"8900 Randers C","Forårets første superligakampe er fastlagt",http://tv2oj-juan2015.develop.fynskemedier.dk/artikel/286300:oestjylland--For-rets-fOerste-superligakampe-er-fastlagt
"8000 Aarhus c","Forårets første superligakampe er fastlagt",http://tv2oj-juan2015.develop.fynskemedier.dk/artikel/286300:oestjylland--For-rets-fOerste-superligakampe-er-fastlagt
"8700 Horsens","Baye Keita vender hjem til Horsens IC",http://tv2oj-juan2015.develop.fynskemedier.dk/artikel/286303:Horsens--Baye-Keita-vender-hjem-til-Horsens-IC
"8900 Randers C","Mand fængslet for at dræbe sin kone i Randers",http://tv2oj-juan2015.develop.fynskemedier.dk/artikel/286306:Randers--Mand-faengslet-for-at-draebe-sin-kone-i-Randers
"8541 Skødstrup","Anbefaling: Kog drikkevandet Fejrup Strand Vandværk ",http://tv2oj-juan2015.develop.fynskemedier.dk/artikel/286311:Syddjurs--Anbefaling--Kog-drikkevandet-Fejrup-Strand-Vandvaerk
"8850 Bjerringbro","BSV henter Kasper Olsen i Aarhus",http://tv2oj-juan2015.develop.fynskemedier.dk/artikel/286313:Silkeborg--BSV-henter-Kasper-Olsen-i-Aarhus
"8900 Randers C","Medie-fusion betyder ændringer ",http://tv2oj-juan2015.develop.fynskemedier.dk/artikel/286329:oestjylland--Medie-fusion-betyder-aendringer
"8000 Aarhus c","Medie-fusion betyder ændringer ",http://tv2oj-juan2015.develop.fynskemedier.dk/artikel/286329:oestjylland--Medie-fusion-betyder-aendringer
"8270 Højbjerg","Taxichauffør overfaldet af kunde",http://tv2oj-juan2015.develop.fynskemedier.dk/artikel/286333:Aarhus--TaxichauffOer-overfaldet-af-kunde
"8000 Aarhus c","Chefredaktør efter fusion: Bliver endnu mere en Aarhus-avis",http://tv2oj-juan2015.develop.fynskemedier.dk/artikel/286334:oestjylland--ChefredaktOer-efter-fusion--Bliver-endnu-mere-en-Aarhus-avis
"8370 Hadsten","Favrskov køber stort areal til byudvikling",http://tv2oj-juan2015.develop.fynskemedier.dk/artikel/286344:Favrskov--Favrskov-kOeber-stort-areal-til-byudvikling
"8900 Randers C","Fischer forlænger med Randers FC",http://tv2oj-juan2015.develop.fynskemedier.dk/artikel/286347:Randers--Fischer-forlaenger-med-Randers-FC
"8305 Samsø","7,5 grønne millioner til Samsø ",http://tv2oj-juan2015.develop.fynskemedier.dk/artikel/286350:SamsOe--7-5-grOenne-millioner-til-SamsOe
"8586 Ørum Djurs","Hvem er ejeren til et 'større kontantbeløb'?",http://tv2oj-juan2015.develop.fynskemedier.dk/artikel/286351:Norddjurs--Hvem-er-ejeren-til-et--stOerre-kontantbelOeb
"Intet postnummer","TV2OJ inviterer til debat om ulven",http://tv2oj-juan2015.develop.fynskemedier.dk/artikel/286355:oestjylland--TV2OJ-inviterer-til-debat-om-ulven
"8500 Grenaa","Træningsforløb skal få borgere i arbejde igen",http://tv2oj-juan2015.develop.fynskemedier.dk/artikel/286361:Norddjurs--TraeningsforlOeb-skal-f--borgere-i-arbejde-igen
"8000 Aarhus c","International hæder: Århusiansk orienteringsløber er bedst",http://tv2oj-juan2015.develop.fynskemedier.dk/artikel/286363:Aarhus--International-haeder---rhusiansk-orienteringslOeber-er-bedst
"8000 Aarhus c","Her overvejer Aarhus asyl-indkvartering",http://tv2oj-juan2015.develop.fynskemedier.dk/artikel/286369:Aarhus--Her-overvejer-Aarhus-asyl-indkvartering
"Intet postnummer","Landsudstilling satte Aarhus på verdenskort ",http://tv2oj-juan2015.develop.fynskemedier.dk/artikel/286372:Aarhus--Landsudstilling-satte-Aarhus-p--verdenskort
"8900 Randers C","Naboer er chokerede over hustru-drab i Randers",http://tv2oj-juan2015.develop.fynskemedier.dk/artikel/286376:Randers--Naboer-er-chokerede-over-hustru-drab-i-Randers
"8700 Horsens","Horsens vil fastholde studerende",http://tv2oj-juan2015.develop.fynskemedier.dk/artikel/286380:Horsens--Horsens-vil-fastholde-studerende
"8000 Aarhus c","Asylansøgere bør blive i kommunen",http://tv2oj-juan2015.develop.fynskemedier.dk/artikel/286385:Aarhus--AsylansOegere-bOer-blive-i-kommunen
"8000 Aarhus c","Mikkel Hansen: Er selv blevet mobbet og har mobbet andre",http://tv2oj-juan2015.develop.fynskemedier.dk/artikel/286388:Aarhus--Mikkel-Hansen--Er-selv-blevet-mobbet-og-har-mobbet-andre
"Intet postnummer","Kraftige vindstød rammer julenat",http://tv2oj-juan2015.develop.fynskemedier.dk/artikel/286394:oestjylland--Kraftige-vindstOed-rammer-julenat
"8400 Ebeltoft","Tættere landsbysamarbejde på vej i Syddjurs Kommune",http://tv2oj-juan2015.develop.fynskemedier.dk/artikel/286419:Syddjurs--Taettere-landsbysamarbejde-p--vej-i-Syddjurs-Kommune
"8000 Aarhus c","Mød Katrine i kampen med og mod ordene ",http://tv2oj-juan2015.develop.fynskemedier.dk/artikel/286421:Aarhus--MOed-Katrine-i-kampen-med-og-mod-ordene
"Intet postnummer","Elapparaterne brænder løs i juletiden ",http://tv2oj-juan2015.develop.fynskemedier.dk/artikel/286422:oestjylland--Elapparaterne-braender-lOes-i-juletiden
"8600 Silkeborg","SIF forlænger med ungt håb fra Djursland ",http://tv2oj-juan2015.develop.fynskemedier.dk/artikel/286424:Silkeborg--SIF-forlaenger-med-ungt-h-b-fra-Djursland
"8000 Aarhus c","Rygtebørsen: Wieghorst i spil til topjob ",http://tv2oj-juan2015.develop.fynskemedier.dk/artikel/286436:Aarhus--RygtebOersen--Wieghorst-i-spil-til-topjob
"Intet postnummer","En vibrator under træet? Sexlegetøj som gave hitter",http://tv2oj-juan2015.develop.fynskemedier.dk/artikel/286438:oestjylland--En-vibrator-under-traeet--SexlegetOej-som-gave-hitter
"8240 Risskov","Glemte sin telefon og undgik væbnet røveri ",http://tv2oj-juan2015.develop.fynskemedier.dk/artikel/286446:Aarhus--Glemte-sin-telefon-og-undgik-vaebnet-rOeveri
"Intet postnummer","Mødrehjælpen i mål: 1.108 midtjyske børn får julehjælp",http://tv2oj-juan2015.develop.fynskemedier.dk/artikel/286462:oestjylland--MOedrehjaelpen-i-m-l--1-108-midtjyske-bOern-f-r-julehjaelp
"Intet postnummer","Juletrafikken glider glat indtil videre ",http://tv2oj-juan2015.develop.fynskemedier.dk/artikel/286463:oestjylland--Juletrafikken-glider-glat-indtil-videre
"8900 Randers C","Hospital tager med patienter hjem",http://tv2oj-juan2015.develop.fynskemedier.dk/artikel/286475:Randers--Hospital-tager-med-patienter-hjem
"8000 Aarhus c","Post Danmark: Travleste jul nogensinde",http://tv2oj-juan2015.develop.fynskemedier.dk/artikel/286482:Aarhus--Post-Danmark--Travleste-jul-nogensinde
"8850 Bjerringbro","Grundfos-arving kigger globalt",http://tv2oj-juan2015.develop.fynskemedier.dk/artikel/286486:oestjylland--Grundfos-arving-kigger-globalt
"Intet postnummer","Vejdirektoratet: Forbløffende rolig juletrafik",http://tv2oj-juan2015.develop.fynskemedier.dk/artikel/286487:oestjylland--Vejdirektoratet--ForblOeffende-rolig-juletrafik
"8000 Aarhus c","Biskop: Vil give håb og trøst i en mørk tid",http://tv2oj-juan2015.develop.fynskemedier.dk/artikel/286491:Aarhus--Biskop--Vil-give-h-b-og-trOest-i-en-mOerk-tid
"8961 Allingåbro","Stjal trailer og kørte væk med tyvekosterne",http://tv2oj-juan2015.develop.fynskemedier.dk/artikel/286495:Norddjurs--Stjal-trailer-og-kOerte-vaek-med-tyvekosterne
"8000 Aarhus c","Bilist tjekkede mobilen: 28-årig aarhusianer dræbt ",http://tv2oj-juan2015.develop.fynskemedier.dk/artikel/286500:Aarhus--Bilist-tjekkede-mobilen--28--rig-aarhusianer-draebt
"8240 Risskov","Indbrudstyv parkerede i indkørslen",http://tv2oj-juan2015.develop.fynskemedier.dk/artikel/286503:Aarhus--Indbrudstyv-parkerede-i-indkOerslen
"8200 Aarhus N","Ny ordre: Vestas får tidlig skotsk julegave",http://tv2oj-juan2015.develop.fynskemedier.dk/artikel/286507:Aarhus--Ny-ordre--Vestas-f-r-tidlig-skotsk-julegave
"Intet postnummer","Ingen sne: Juleaften bliver mild og våd",http://tv2oj-juan2015.develop.fynskemedier.dk/artikel/286509:oestjylland--Ingen-sne--Juleaften-bliver-mild-og-v-d
"Intet postnummer","De rejsende kom sikkert frem til jul",http://tv2oj-juan2015.develop.fynskemedier.dk/artikel/286512:oestjylland--De-rejsende-kom-sikkert-frem-til-jul
"8900 Randers C","Cheftræner opereret: Misser opstart",http://tv2oj-juan2015.develop.fynskemedier.dk/artikel/286513:Randers--Cheftraener-opereret--Misser-opstart
"Intet postnummer","Fæl lugt: Denne and skal kasseres",http://tv2oj-juan2015.develop.fynskemedier.dk/artikel/286517:oestjylland--Fael-lugt--Denne-and-skal-kasseres
"8900 Randers C","Mads bruger sin jul på at lave festmåltid til udsatte ",http://tv2oj-juan2015.develop.fynskemedier.dk/artikel/286534:Randers--Mads-bruger-sin-jul-p--at-lave-festm-ltid-til-udsatte
"Intet postnummer","Politiet: Det skal ligne at du er hjemme ",http://tv2oj-juan2015.develop.fynskemedier.dk/artikel/286538:oestjylland--Politiet--Det-skal-ligne-at-du-er-hjemme
"8220 Brabrand","Fandt kniv i bil efter færdselsuheld ",http://tv2oj-juan2015.develop.fynskemedier.dk/artikel/286543:Aarhus--Fandt-kniv-i-bil-efter-faerdselsuheld
"8900 Randers C","300 meter kø til gratis besøg i regnskoven ",http://tv2oj-juan2015.develop.fynskemedier.dk/artikel/286544:Randers--300-meter-kOe-til-gratis-besOeg-i-regnskoven
"8700 Horsens","Nissehuer til de nyfødte der holder jul på fødegangen ",http://tv2oj-juan2015.develop.fynskemedier.dk/artikel/286546:Horsens--Nissehuer-til-de-nyfOedte-der-holder-jul-p--fOedegangen
"Intet postnummer","DMI advarer mod vind af stormstyrke",http://tv2oj-juan2015.develop.fynskemedier.dk/artikel/286549:oestjylland--DMI-advarer-mod-vind-af-stormstyrke
"8000 Aarhus c","Cyklist i kritisk tilstand efter at være blevet ramt af bil ",http://tv2oj-juan2015.develop.fynskemedier.dk/artikel/286551:Aarhus--Cyklist-i-kritisk-tilstand-efter-at-vaere-blevet-ramt-af-bil
"8900 Randers C","Randers-keeper vinder af ’Det gyldne bur’ ",http://tv2oj-juan2015.develop.fynskemedier.dk/artikel/286555:Randers--Randers-keeper-vinder-af--Det-gyldne-bur
"8000 Aarhus c","Jul for dem på udveksling i Aarhus ",http://tv2oj-juan2015.develop.fynskemedier.dk/artikel/286557:Aarhus--Jul-for-dem-p--udveksling-i-Aarhus
"8900 Randers C","Danish Crown trækker salmonella-ramt kød tilbage",http://tv2oj-juan2015.develop.fynskemedier.dk/artikel/286558:oestjylland--Danish-Crown-traekker-salmonella-ramt-kOed-tilbage
"8240 Risskov","Æbleskiver og iskoldt vand før julemiddagen ",http://tv2oj-juan2015.develop.fynskemedier.dk/artikel/286560:Aarhus--AEbleskiver-og-iskoldt-vand-fOer-julemiddagen
"8900 Randers C","Julerekorden slået i Randers Regnskov ",http://tv2oj-juan2015.develop.fynskemedier.dk/artikel/286561:Randers--Julerekorden-sl-et-i-Randers-Regnskov
"Intet postnummer","Politiet er forberedt på travl 1. juledag",http://tv2oj-juan2015.develop.fynskemedier.dk/artikel/286587:oestjylland--Politiet-er-forberedt-p--travl-1--juledag
"8200 Aarhus N","USA: Vestas får kæmpeordre på vindmøller",http://tv2oj-juan2015.develop.fynskemedier.dk/artikel/286590:Aarhus--USA--Vestas-f-r-kaempeordre-p--vindmOeller
"8600 Silkeborg","Trodser ALS: Skriver bog med øjnene",http://tv2oj-juan2015.develop.fynskemedier.dk/artikel/286595:Silkeborg--Trodser-ALS--Skriver-bog-med-Oejnene
"Intet postnummer","Har du haft indbrud: Det skal du gøre",http://tv2oj-juan2015.develop.fynskemedier.dk/artikel/286596:oestjylland--Har-du-haft-indbrud--Det-skal-du-gOere
"8000 Aarhus c","Venstresving årsag til cyklist i kritisk tilstand",http://tv2oj-juan2015.develop.fynskemedier.dk/artikel/286601:Aarhus--Venstresving--rsag-til-cyklist-i-kritisk-tilstand
"8600 Silkeborg","Klagede over smerter efter påkørsel",http://tv2oj-juan2015.develop.fynskemedier.dk/artikel/286605:Silkeborg--Klagede-over-smerter-efter-p-kOersel
"8900 Randers C","Værested hjælper ensomme",http://tv2oj-juan2015.develop.fynskemedier.dk/artikel/286612:Randers--Vaerested-hjaelper-ensomme
"Intet postnummer","Her kan der komme slud 2. juledag",http://tv2oj-juan2015.develop.fynskemedier.dk/artikel/286614:oestjylland--Her-kan-der-komme-slud-2--juledag
"Intet postnummer","DMI: Risiko for kraftig regn og oversvømmelse",http://tv2oj-juan2015.develop.fynskemedier.dk/artikel/286617:oestjylland--DMI--Risiko-for-kraftig-regn-og-oversvOemmelse
"Intet postnummer","Vejdirektoratet: Kør hjem tidligt eller sent efter juleferien",http://tv2oj-juan2015.develop.fynskemedier.dk/artikel/286620:oestjylland--Vejdirektoratet--KOer-hjem-tidligt-eller-sent-efter-juleferien
"8000 Aarhus c","Kontrasternes 1. juledag: Kælk i 2014 – 10 grader i 2015",http://tv2oj-juan2015.develop.fynskemedier.dk/artikel/286623:Aarhus--Kontrasternes-1--juledag--Kaelk-i-2014---10-grader-i-2015
"8200 Aarhus N","Vestas-mølle kollapset i Sverige",http://tv2oj-juan2015.develop.fynskemedier.dk/artikel/286643:Aarhus--Vestas-mOelle-kollapset-i-Sverige
"8220 Brabrand","Brand på tidligere Tulip-slagteri",http://tv2oj-juan2015.develop.fynskemedier.dk/artikel/286644:Aarhus--Brand-p--tidligere-Tulip-slagteri
