"8900 Randers C","Pædofilisag i Randers: Politi holder øje med Facebook-trusler",http://tv2oj-juan2015.develop.fynskemedier.dk/artikel/276346:Randers--Paedofilisag-i-Randers--Politi-holder-Oeje-med-Facebook-trusler
"8270 Højbjerg","Moesgaard Museum fejrer et års fødselsdag: Et okay godt museum ",http://tv2oj-juan2015.develop.fynskemedier.dk/artikel/276352:Aarhus--Moesgaard-Museum-fejrer-et--rs-fOedselsdag--Et-okay-godt-museum
"8900 Randers C","Socialrådgivere er bekymrede for fremtiden ",http://tv2oj-juan2015.develop.fynskemedier.dk/artikel/276354:Randers--Socialr-dgivere-er-bekymrede-for-fremtiden
"8900 Randers C","Politiker: Ingen lovbrud på grund af budget ",http://tv2oj-juan2015.develop.fynskemedier.dk/artikel/276357:Randers--Politiker--Ingen-lovbrud-p--grund-af-budget
"8000 Aarhus c","Festival hylder hverdagens opfindere ",http://tv2oj-juan2015.develop.fynskemedier.dk/artikel/276362:Aarhus--Festival-hylder-hverdagens-opfindere
"8660 Skanderborg","Alvorlig ulykke ved Foldby: Motorcyklist er afgået ved døden ",http://tv2oj-juan2015.develop.fynskemedier.dk/artikel/276364:Favrskov--Alvorlig-ulykke-ved-Foldby--Motorcyklist-er-afg-et-ved-dOeden
"8983 Gjerlev J","Forældre må måske droppe friskoleplaner ",http://tv2oj-juan2015.develop.fynskemedier.dk/artikel/276371:Randers--Foraeldre-m--m-ske-droppe-friskoleplaner
"8000 Aarhus c","Aarhusianske tvillingebrødre er hurtige og grundige med østers ",http://tv2oj-juan2015.develop.fynskemedier.dk/artikel/276376:Aarhus--Aarhusianske-tvillingebrOedre-er-hurtige-og-grundige-med-Oesters
"8270 Højbjerg","Mand gik amok på medtrafikant: Skubbede ham hårdt i asfalten ",http://tv2oj-juan2015.develop.fynskemedier.dk/artikel/276406:Aarhus--Mand-gik-amok-p--medtrafikant--Skubbede-ham-h-rdt-i-asfalten
"8381 Tilst","Butikstyv slog og skubbede detektiv",http://tv2oj-juan2015.develop.fynskemedier.dk/artikel/276407:Aarhus--Butikstyv-slog-og-skubbede-detektiv
"8000 Aarhus c","Franskmand er også klar på østjysk hold",http://tv2oj-juan2015.develop.fynskemedier.dk/artikel/276410:oestjylland--Franskmand-er-ogs--klar-p--Oestjysk-hold
"8700 Horsens","Horsens-sejler vinder EM Cup: Nu venter slutspurt om OL-billet ",http://tv2oj-juan2015.develop.fynskemedier.dk/artikel/276421:Horsens--Horsens-sejler-vinder-EM-Cup--Nu-venter-slutspurt-om-OL-billet
"8220 Brabrand","Flammer i skraldespand i Brabrand ",http://tv2oj-juan2015.develop.fynskemedier.dk/artikel/276425:Aarhus--Flammer-i-skraldespand-i-Brabrand
"8382 Hinnerup","Stævne i pløjning: Steen starter traktoren med en svensknøgle ",http://tv2oj-juan2015.develop.fynskemedier.dk/artikel/276430:Favrskov--Staevne-i-plOejning--Steen-starter-traktoren-med-en-svensknOegle
"8600 Silkeborg","Socialdemokrat får fast plads i byrådet ",http://tv2oj-juan2015.develop.fynskemedier.dk/artikel/276437:Silkeborg--Socialdemokrat-f-r-fast-plads-i-byr-det
"8000 Aarhus c","Rådmænd i fælles fodboldfront: Byen skal have et rigtigt stadion ",http://tv2oj-juan2015.develop.fynskemedier.dk/artikel/276440:Aarhus--R-dmaend-i-faelles-fodboldfront--Byen-skal-have-et-rigtigt-stadion
"8464 Galten","Flere vil være økologisk landmand ",http://tv2oj-juan2015.develop.fynskemedier.dk/artikel/276444:Skanderborg--Flere-vil-vaere-Oekologisk-landmand
"8000 Aarhus c","AGF-direktør: Realistisk med nyt stadion ",http://tv2oj-juan2015.develop.fynskemedier.dk/artikel/276448:Aarhus--AGF-direktOer--Realistisk-med-nyt-stadion
"Intet postnummer","Tørt og skyet vejr venter i efterårsferien ",http://tv2oj-juan2015.develop.fynskemedier.dk/artikel/276451:oestjylland--TOert-og-skyet-vejr-venter-i-efter-rsferien
"8000 Aarhus c","På sporet af ulven: Simon er ulvetracker ",http://tv2oj-juan2015.develop.fynskemedier.dk/artikel/276453:oestjylland--P--sporet-af-ulven--Simon-er-ulvetracker
"8000 Aarhus c","18-årig mand blev nikket en skalle i Aarhus",http://tv2oj-juan2015.develop.fynskemedier.dk/artikel/276458:Aarhus--18--rig-mand-blev-nikket-en-skalle-i-Aarhus
"8230 Åbyhøj","Fodbolddrenge på efterårstur til Spanien ",http://tv2oj-juan2015.develop.fynskemedier.dk/artikel/276461:Aarhus--Fodbolddrenge-p--efter-rstur-til-Spanien
"Intet postnummer","Uenighed om økologi: DF mener, at målsætning var for ambitiøs",http://tv2oj-juan2015.develop.fynskemedier.dk/artikel/276464:oestjylland--Uenighed-om-Oekologi--DF-mener--at-m-lsaetning-var-for-ambitiOes
"8700 Horsens","Trafikulykke: Mand slynges ud af bil og dør",http://tv2oj-juan2015.develop.fynskemedier.dk/artikel/276480:Horsens--Trafikulykke--Mand-slynges-ud-af-bil-og-dOer
"8000 Aarhus c","Aarhus 1900-maratonløber er klar til OL",http://tv2oj-juan2015.develop.fynskemedier.dk/artikel/276483:Aarhus--Aarhus-1900-maratonlOeber-er-klar-til-OL
"Intet postnummer","Østjyder betaler prisen for terrorberedskab i København",http://tv2oj-juan2015.develop.fynskemedier.dk/artikel/276487:oestjylland--oestjyder-betaler-prisen-for-terrorberedskab-i-KOebenhavn
"8850 Bjerringbro","Håndbold: BSV genfandt sejrsmelodien",http://tv2oj-juan2015.develop.fynskemedier.dk/artikel/276488:Silkeborg--H-ndbold--BSV-genfandt-sejrsmelodien
"8240 Risskov","Tre-point-rekord i ny Bears-sejr",http://tv2oj-juan2015.develop.fynskemedier.dk/artikel/276507:Aarhus--Tre-point-rekord-i-ny-Bears-sejr
"8900 Randers C","Tre nederlag på stribe og en bundplacering",http://tv2oj-juan2015.develop.fynskemedier.dk/artikel/276510:Randers--Tre-nederlag-p--stribe-og-en-bundplacering
"8000 Aarhus c","Flygtninge lærer dansk i Bilka",http://tv2oj-juan2015.develop.fynskemedier.dk/artikel/276512:Aarhus--Flygtninge-laerer-dansk-i-Bilka
"Intet postnummer","Cult har den store pung åben til ny sæson",http://tv2oj-juan2015.develop.fynskemedier.dk/artikel/276515:Aarhus--Cult-har-den-store-pung--ben-til-ny-saeson
"8000 Aarhus c","Vild uenighed: Nyt stadion skaber debat på Facebook",http://tv2oj-juan2015.develop.fynskemedier.dk/artikel/276521:Aarhus--Vild-uenighed--Nyt-stadion-skaber-debat-p--Facebook
"8900 Randers C","Spirituspåvirket kvinde påkørte lysstander",http://tv2oj-juan2015.develop.fynskemedier.dk/artikel/276527:Randers--Spiritusp-virket-kvinde-p-kOerte-lysstander
"8000 Aarhus c","Øvelse: Sirener afprøves på havnen i Aarhus",http://tv2oj-juan2015.develop.fynskemedier.dk/artikel/276529:Aarhus--oevelse--Sirener-afprOeves-p--havnen-i-Aarhus
"8400 Ebeltoft","Restaurering af Fregatten: Det er ligesom at pumpe luft i en bold",http://tv2oj-juan2015.develop.fynskemedier.dk/artikel/276531:Syddjurs--Restaurering-af-Fregatten--Det-er-ligesom-at-pumpe-luft-i-en-bold
"8000 Aarhus c","Sammenstød: Kvinde uden for livsfare",http://tv2oj-juan2015.develop.fynskemedier.dk/artikel/276536:Aarhus--SammenstOed--Kvinde-uden-for-livsfare
"8000 Aarhus c","Aarhus Pigekor vinder Silver Rose Bowl",http://tv2oj-juan2015.develop.fynskemedier.dk/artikel/276537:Aarhus--Aarhus-Pigekor-vinder-Silver-Rose-Bowl
"8680 Ry","Søren og Emma fra Gl. Rye har nu fået deres drømmehave ",http://tv2oj-juan2015.develop.fynskemedier.dk/artikel/276542:Skanderborg--SOeren-og-Emma-fra-Gl--Rye-har-nu-f-et-deres-drOemmehave
"8660 Skanderborg","Knuste ruder og stjålne airbags: Tyve hærger i Skanderborg",http://tv2oj-juan2015.develop.fynskemedier.dk/artikel/276547:Skanderborg--Knuste-ruder-og-stj-lne-airbags--Tyve-haerger-i-Skanderborg
"8000 Aarhus c","Retssag om scooter-skyderi begynder i dag",http://tv2oj-juan2015.develop.fynskemedier.dk/artikel/276548:Aarhus--Retssag-om-scooter-skyderi-begynder-i-dag
"8900 Randers C","Håndboldpiger lærer tricks af Camilla Dalby ",http://tv2oj-juan2015.develop.fynskemedier.dk/artikel/276554:Randers--H-ndboldpiger-laerer-tricks-af-Camilla-Dalby
"Intet postnummer","Region Midtjylland: 170 skal fyres",http://tv2oj-juan2015.develop.fynskemedier.dk/artikel/276557:oestjylland--Region-Midtjylland--170-skal-fyres
"Intet postnummer","Politi: Vi efterspørger at få en hverdag igen",http://tv2oj-juan2015.develop.fynskemedier.dk/artikel/276559:oestjylland--Politi--Vi-efterspOerger-at-f--en-hverdag-igen
"8000 Aarhus c","Aarhusiansk kor gav koncert i Rio: En eventyrlig oplevelse ",http://tv2oj-juan2015.develop.fynskemedier.dk/artikel/276563:Aarhus--Aarhusiansk-kor-gav-koncert-i-Rio--En-eventyrlig-oplevelse
"Intet postnummer","Nordmændene skal lokkes til Østjylland",http://tv2oj-juan2015.develop.fynskemedier.dk/artikel/276564:oestjylland--Nordmaendene-skal-lokkes-til-oestjylland
"Intet postnummer","DSB tilbyder flere afgange til Flensborg",http://tv2oj-juan2015.develop.fynskemedier.dk/artikel/276573:oestjylland--DSB-tilbyder-flere-afgange-til-Flensborg
"8700 Horsens","Horsens vært for gratis U-landskamp ",http://tv2oj-juan2015.develop.fynskemedier.dk/artikel/276583:Horsens--Horsens-vaert-for-gratis-U-landskamp
"8700 Horsens","Iltsvind ved Horsens Havn undersøges ",http://tv2oj-juan2015.develop.fynskemedier.dk/artikel/276585:Horsens--Iltsvind-ved-Horsens-Havn-undersOeges
"8500 Grenaa","Oliespild måtte stoppes flere gange ",http://tv2oj-juan2015.develop.fynskemedier.dk/artikel/276590:Norddjurs--Oliespild-m-tte-stoppes-flere-gange
"8900 Randers C","Succestræner stopper i Randers HH ",http://tv2oj-juan2015.develop.fynskemedier.dk/artikel/276594:Randers--Succestraener-stopper-i-Randers-HH
"8581 Nimtofte","Djurs Sommerland vil åbne et resort i forlystelsesparken ",http://tv2oj-juan2015.develop.fynskemedier.dk/artikel/276598:Syddjurs--Djurs-Sommerland-vil--bne-et-resort-i-forlystelsesparken
"8000 Aarhus c","Mew spiller gratis koncert på Steno Museet ",http://tv2oj-juan2015.develop.fynskemedier.dk/artikel/276600:Aarhus--Mew-spiller-gratis-koncert-p--Steno-Museet
"Intet postnummer","Gråt igen – men så kommer solen ",http://tv2oj-juan2015.develop.fynskemedier.dk/artikel/276604:oestjylland--Gr-t-igen---men-s--kommer-solen
"8000 Aarhus c","Studerende klar til VM i robotbyggeri",http://tv2oj-juan2015.develop.fynskemedier.dk/artikel/276610:Aarhus--Studerende-klar-til-VM-i-robotbyggeri
"8700 Horsens","Fremtidens stjerner vandt i Horsens",http://tv2oj-juan2015.develop.fynskemedier.dk/artikel/276627:Horsens--Fremtidens-stjerner-vandt-i-Horsens
"8900 Randers C","Handicappede tog billeder af Kim Larsen",http://tv2oj-juan2015.develop.fynskemedier.dk/artikel/276628:Randers--Handicappede-tog-billeder-af-Kim-Larsen
"8600 Silkeborg","Nyvalgt MF'er fra Silkeborg: Jeg vil lave dansk politik om",http://tv2oj-juan2015.develop.fynskemedier.dk/artikel/276630:Silkeborg--Nyvalgt-MF-er-fra-Silkeborg--Jeg-vil-lave-dansk-politik-om
"8260 Viby J","Uheld i morgentrafikken: Lastbil kilet fast under bro",http://tv2oj-juan2015.develop.fynskemedier.dk/artikel/276638:Aarhus--Uheld-i-morgentrafikken--Lastbil-kilet-fast-under-bro
"8620 Kjellerup","Brand på skole: Unge slog alarm",http://tv2oj-juan2015.develop.fynskemedier.dk/artikel/276644:Silkeborg--Brand-p--skole--Unge-slog-alarm
"8600 Silkeborg","Solouheld: Bilist kørte ind i lygtepæl",http://tv2oj-juan2015.develop.fynskemedier.dk/artikel/276646:Silkeborg--Solouheld--Bilist-kOerte-ind-i-lygtepael
"Intet postnummer","Farvel krise: 1.231 nye selskaber",http://tv2oj-juan2015.develop.fynskemedier.dk/artikel/276648:oestjylland--Farvel-krise--1-231-nye-selskaber
"8000 Aarhus c","Nyt stenrev skal lokke sæler og marsvin til Aarhus",http://tv2oj-juan2015.develop.fynskemedier.dk/artikel/276661:Aarhus--Nyt-stenrev-skal-lokke-saeler-og-marsvin-til-Aarhus
"8000 Aarhus c","Mega Kup: Vi er glade for Godsbanen",http://tv2oj-juan2015.develop.fynskemedier.dk/artikel/276663:Aarhus--Mega-Kup--Vi-er-glade-for-Godsbanen
"8260 Viby J","Se lastbil blive vristet løs fra viadukt",http://tv2oj-juan2015.develop.fynskemedier.dk/artikel/276665:Aarhus--Se-lastbil-blive-vristet-lOes-fra-viadukt
"Intet postnummer","DSB om ny køreplan: Største ændring siden Storebæltsbroen ",http://tv2oj-juan2015.develop.fynskemedier.dk/artikel/276666:oestjylland--DSB-om-ny-kOereplan--StOerste-aendring-siden-Storebaeltsbroen
"8220 Brabrand","46-årig tyv gemte sig i baghave",http://tv2oj-juan2015.develop.fynskemedier.dk/artikel/276667:Aarhus--46--rig-tyv-gemte-sig-i-baghave
"8260 Viby J","Tricktyve smadrede rude og stak af",http://tv2oj-juan2015.develop.fynskemedier.dk/artikel/276668:Aarhus--Tricktyve-smadrede-rude-og-stak-af
"8000 Aarhus c","Northside håber på første offentliggørelser i oktober ",http://tv2oj-juan2015.develop.fynskemedier.dk/artikel/276679:Aarhus--Northside-h-ber-p--fOerste-offentliggOerelser-i-oktober
"8000 Aarhus c","Blev ramt af lastbil under køreprøve",http://tv2oj-juan2015.develop.fynskemedier.dk/artikel/276684:Aarhus--Blev-ramt-af-lastbil-under-kOereprOeve
"Intet postnummer","Narkobilister gav politiet en travl dag ",http://tv2oj-juan2015.develop.fynskemedier.dk/artikel/276689:oestjylland--Narkobilister-gav-politiet-en-travl-dag
"8000 Aarhus c","Farvel til Aarhus' ældste værtshus",http://tv2oj-juan2015.develop.fynskemedier.dk/artikel/276700:Aarhus--Farvel-til-Aarhus--aeldste-vaertshus
"8410 Rønde","Musikalske stjerner fra Verdensballet til Møllerup Gods",http://tv2oj-juan2015.develop.fynskemedier.dk/artikel/276707:Syddjurs--Musikalske-stjerner-fra-Verdensballet-til-MOellerup-Gods
"8210 Aarhus V","Mand udsat for røveri med pistol",http://tv2oj-juan2015.develop.fynskemedier.dk/artikel/276709:Aarhus--Mand-udsat-for-rOeveri-med-pistol
"8000 Aarhus c","Tre mænd anholdt kort efter indbrud",http://tv2oj-juan2015.develop.fynskemedier.dk/artikel/276714:Aarhus--Tre-maend-anholdt-kort-efter-indbrud
"8210 Aarhus V","Bilister i Aarhus V slipper for politiets fotovogne",http://tv2oj-juan2015.develop.fynskemedier.dk/artikel/276724:Aarhus--Bilister-i-Aarhus-V-slipper-for-politiets-fotovogne
"8700 Horsens","Horsens IC slår Næstved i tæt kamp",http://tv2oj-juan2015.develop.fynskemedier.dk/artikel/276725:Horsens--Horsens-IC-sl-r-Naestved-i-taet-kamp
"8381 Tilst","Flygtninge lærer dansk i Bilka",http://tv2oj-juan2015.develop.fynskemedier.dk/artikel/276729:Aarhus--Flygtninge-laerer-dansk-i-Bilka
"Intet postnummer","Onsdag og torsdag kommer solen",http://tv2oj-juan2015.develop.fynskemedier.dk/artikel/276737:oestjylland--Onsdag-og-torsdag-kommer-solen
"8900 Randers C","Tyve væltede port og stjal betonblander",http://tv2oj-juan2015.develop.fynskemedier.dk/artikel/276742:Randers--Tyve-vaeltede-port-og-stjal-betonblander
"8600 Silkeborg","Solberg fik debut på U21-landsholdet",http://tv2oj-juan2015.develop.fynskemedier.dk/artikel/276745:Silkeborg--Solberg-fik-debut-p--U21-landsholdet
"Intet postnummer","Kun tre af 100 statsansatte vil flytte til provinsen",http://tv2oj-juan2015.develop.fynskemedier.dk/artikel/276767:oestjylland--Kun-tre-af-100-statsansatte-vil-flytte-til-provinsen
"Intet postnummer","Landdistrikter: Skrot måling om udflytning",http://tv2oj-juan2015.develop.fynskemedier.dk/artikel/276771:oestjylland--Landdistrikter--Skrot-m-ling-om-udflytning
"8370 Hadsten","Punkteret lastbil giver kø på E45",http://tv2oj-juan2015.develop.fynskemedier.dk/artikel/276772:Favrskov--Punkteret-lastbil-giver-kOe-p--E45
"8200 Aarhus N","Punkteret lastbil giver kø på E45",http://tv2oj-juan2015.develop.fynskemedier.dk/artikel/276772:Favrskov--Punkteret-lastbil-giver-kOe-p--E45
"8560 Kolind","Direkte sommer-flyrute fra Aarhus til Mallorca",http://tv2oj-juan2015.develop.fynskemedier.dk/artikel/276775:oestjylland--Direkte-sommer-flyrute-fra-Aarhus-til-Mallorca
"8541 Skødstrup","Velbevaret jernalderby fundet på mark",http://tv2oj-juan2015.develop.fynskemedier.dk/artikel/276779:Aarhus--Velbevaret-jernalderby-fundet-p--mark
"8700 Horsens","Cult-Stölting forlænger med Horsens-rytter",http://tv2oj-juan2015.develop.fynskemedier.dk/artikel/276784:Horsens--Cult-St-lting-forlaenger-med-Horsens-rytter
"8541 Skødstrup","VIDEO: Kig indenfor på nyopdaget jernalderboplads",http://tv2oj-juan2015.develop.fynskemedier.dk/artikel/276790:Aarhus--VIDEO--Kig-indenfor-p--nyopdaget-jernalderboplads
"8000 Aarhus c","Atletiktræner: Vi vil ikke til Viby Stadion",http://tv2oj-juan2015.develop.fynskemedier.dk/artikel/276791:Aarhus--Atletiktraener--Vi-vil-ikke-til-Viby-Stadion
"8900 Randers C","Høns generede trafikken på motorvej",http://tv2oj-juan2015.develop.fynskemedier.dk/artikel/276803:Randers--HOens-generede-trafikken-p--motorvej
"8000 Aarhus c","21-årig mand slået ned og røvet",http://tv2oj-juan2015.develop.fynskemedier.dk/artikel/276805:Aarhus--21--rig-mand-sl-et-ned-og-rOevet
"8000 Aarhus c","Emma og Esben er gæst nummer 500.000 i Dokk1",http://tv2oj-juan2015.develop.fynskemedier.dk/artikel/276808:Aarhus--Emma-og-Esben-er-gaest-nummer-500-000-i-Dokk1
"8450 Hammel","Hammel får en miljørigtig kunstgræsbane",http://tv2oj-juan2015.develop.fynskemedier.dk/artikel/276815:Favrskov--Hammel-f-r-en-miljOerigtig-kunstgraesbane
"8000 Aarhus c","Anmeldere begejstrede for Monet",http://tv2oj-juan2015.develop.fynskemedier.dk/artikel/276816:Aarhus--Anmeldere-begejstrede-for-Monet
"8220 Brabrand","Folketingsmedlem vil have minister i samråd om fotovogne ",http://tv2oj-juan2015.develop.fynskemedier.dk/artikel/276831:Aarhus--Folketingsmedlem-vil-have-minister-i-samr-d-om-fotovogne
"8000 Aarhus c","AGF’s angrebs-håb viste målform ",http://tv2oj-juan2015.develop.fynskemedier.dk/artikel/276834:Aarhus--AGF-s-angrebs-h-b-viste-m-lform
"8381 Tilst","Bygger træmand på trafikeret vej ",http://tv2oj-juan2015.develop.fynskemedier.dk/artikel/276838:Aarhus--Bygger-traemand-p--trafikeret-vej
"8541 Skødstrup","Arkæolog: Vi ved ikke hvorfor kraniet mangler",http://tv2oj-juan2015.develop.fynskemedier.dk/artikel/276854:Aarhus--Arkaeolog--Vi-ved-ikke-hvorfor-kraniet-mangler
"Intet postnummer","Tørvejr torsdag – men så kommer regnen ",http://tv2oj-juan2015.develop.fynskemedier.dk/artikel/276861:oestjylland--TOervejr-torsdag---men-s--kommer-regnen
"8541 Skødstrup","Slap billigt efter uheld på motorvejen ",http://tv2oj-juan2015.develop.fynskemedier.dk/artikel/276863:Aarhus--Slap-billigt-efter-uheld-p--motorvejen
"8400 Ebeltoft","Hotel Fuglsøcentret er gået fra fiasko til succes ",http://tv2oj-juan2015.develop.fynskemedier.dk/artikel/276867:Syddjurs--Hotel-FuglsOecentret-er-g-et-fra-fiasko-til-succes
"8600 Silkeborg","Ungebyråd skal til orde i Silkeborg ",http://tv2oj-juan2015.develop.fynskemedier.dk/artikel/276871:Silkeborg--Ungebyr-d-skal-til-orde-i-Silkeborg
"8000 Aarhus c","Både herrerne og damerne blev overhalet",http://tv2oj-juan2015.develop.fynskemedier.dk/artikel/276874:Aarhus--B-de-herrerne-og-damerne-blev-overhalet
"8000 Aarhus c","35-årig mand stukket ned med kniv foran sin lejlighed",http://tv2oj-juan2015.develop.fynskemedier.dk/artikel/276892:Aarhus--35--rig-mand-stukket-ned-med-kniv-foran-sin-lejlighed
"8700 Horsens","Opdatering: 20-årig uden for livsfare ",http://tv2oj-juan2015.develop.fynskemedier.dk/artikel/276893:Horsens--Opdatering--20--rig-uden-for-livsfare
"Intet postnummer","Færre og færre patienter dør af kræft",http://tv2oj-juan2015.develop.fynskemedier.dk/artikel/276894:oestjylland--Faerre-og-faerre-patienter-dOer-af-kraeft
"8900 Randers C","Langbenet fyr på besøg tæt på Randers ",http://tv2oj-juan2015.develop.fynskemedier.dk/artikel/276897:Randers--Langbenet-fyr-p--besOeg-taet-p--Randers
"8700 Horsens","Horsens hjælper danskerne med at drikke mindre",http://tv2oj-juan2015.develop.fynskemedier.dk/artikel/276904:Horsens--Horsens-hjaelper-danskerne-med-at-drikke-mindre
"8900 Randers C","Advokat i hackersag: Vi har rykket politiet adskillige gange",http://tv2oj-juan2015.develop.fynskemedier.dk/artikel/276906:Randers--Advokat-i-hackersag--Vi-har-rykket-politiet-adskillige-gange
"8000 Aarhus c","Mænd truede sig til sprut i kiosk",http://tv2oj-juan2015.develop.fynskemedier.dk/artikel/276917:Aarhus--Maend-truede-sig-til-sprut-i-kiosk
"Intet postnummer","Cult forlænger med rutineret tysker",http://tv2oj-juan2015.develop.fynskemedier.dk/artikel/276919:oestjylland--Cult-forlaenger-med-rutineret-tysker
"8400 Ebeltoft","Museum i Ebeltoft slår alle rekorder",http://tv2oj-juan2015.develop.fynskemedier.dk/artikel/276924:Syddjurs--Museum-i-Ebeltoft-sl-r-alle-rekorder
"8000 Aarhus c","SF vil have bilfri søndag i Aarhus",http://tv2oj-juan2015.develop.fynskemedier.dk/artikel/276934:Aarhus--SF-vil-have-bilfri-sOendag-i-Aarhus
"8660 Skanderborg","Kirsten Rold bekæmpede ebola i Afrika: Det var barskt",http://tv2oj-juan2015.develop.fynskemedier.dk/artikel/276935:Skanderborg--Kirsten-Rold-bekaempede-ebola-i-Afrika--Det-var-barskt
"8620 Kjellerup","Kæmper for østjysk politiskole",http://tv2oj-juan2015.develop.fynskemedier.dk/artikel/276945:Silkeborg--Kaemper-for-Oestjysk-politiskole
"8600 Silkeborg","Kæmper for østjysk politiskole",http://tv2oj-juan2015.develop.fynskemedier.dk/artikel/276945:Silkeborg--Kaemper-for-Oestjysk-politiskole
"8900 Randers C","Tricktyv snød ekspedient for større beløb",http://tv2oj-juan2015.develop.fynskemedier.dk/artikel/276949:Randers--Tricktyv-snOed-ekspedient-for-stOerre-belOeb
"8600 Silkeborg","Arkitektur'en ser nærmere på kunstmuseer",http://tv2oj-juan2015.develop.fynskemedier.dk/artikel/276951:Silkeborg--Arkitektur-en-ser-naermere-p--kunstmuseer
"Intet postnummer","Politiet: Sag om angreb på NemID lå ikke død i måneder",http://tv2oj-juan2015.develop.fynskemedier.dk/artikel/276963:oestjylland--Politiet--Sag-om-angreb-p--NemID-l--ikke-dOed-i-m-neder
"8620 Kjellerup","Ser positivt på politiskole-planer",http://tv2oj-juan2015.develop.fynskemedier.dk/artikel/276964:Silkeborg--Ser-positivt-p--politiskole-planer
"8240 Risskov","Drenge skudt med haglgevær: 27-årig idømt tre års fængsel ",http://tv2oj-juan2015.develop.fynskemedier.dk/artikel/276967:Aarhus--Drenge-skudt-med-haglgevaer--27--rig-idOemt-tre--rs-faengsel
"8660 Skanderborg","Håndbold-feberen raser i Skanderborg",http://tv2oj-juan2015.develop.fynskemedier.dk/artikel/276969:Skanderborg--H-ndbold-feberen-raser-i-Skanderborg
"8961 Allingåbro","Signalkrebs truer dyrelivet tæt på Gudenå",http://tv2oj-juan2015.develop.fynskemedier.dk/artikel/276991:oestjylland--Signalkrebs-truer-dyrelivet-taet-p--Guden
"8700 Horsens","Kvinder søger rådgivning om alkohol ",http://tv2oj-juan2015.develop.fynskemedier.dk/artikel/276997:Horsens--Kvinder-sOeger-r-dgivning-om-alkohol
"Intet postnummer","Stadig to-cifrede varmegrader",http://tv2oj-juan2015.develop.fynskemedier.dk/artikel/276999:oestjylland--Stadig-to-cifrede-varmegrader
"8000 Aarhus c","Aarhusianere udpeger bedste rom",http://tv2oj-juan2015.develop.fynskemedier.dk/artikel/277002:Aarhus--Aarhusianere-udpeger-bedste-rom
"8210 Aarhus V","Fyrværkeri udviklede røg i opgang",http://tv2oj-juan2015.develop.fynskemedier.dk/artikel/277006:Aarhus--Fyrvaerkeri-udviklede-rOeg-i-opgang
"Intet postnummer","Nyvalgt MF’er: østjyske mærkesager er vigtige",http://tv2oj-juan2015.develop.fynskemedier.dk/artikel/277016:oestjylland--Nyvalgt-MF-er--Oestjyske-maerkesager-er-vigtige
"8850 Bjerringbro","BSV fik sæsonens anden udesejr",http://tv2oj-juan2015.develop.fynskemedier.dk/artikel/277021:Silkeborg--BSV-fik-saesonens-anden-udesejr
"8200 Aarhus N","Vestas skal sende 72 møller til USA",http://tv2oj-juan2015.develop.fynskemedier.dk/artikel/277039:Aarhus--Vestas-skal-sende-72-mOeller-til-USA
"8000 Aarhus c","Skulderklap til Aarhus Søfarts Museum ",http://tv2oj-juan2015.develop.fynskemedier.dk/artikel/277040:Aarhus--Skulderklap-til-Aarhus-SOefarts-Museum
"8900 Randers C","RFC møder forsvarende mestre",http://tv2oj-juan2015.develop.fynskemedier.dk/artikel/277042:Randers--RFC-mOeder-forsvarende-mestre
"8500 Grenaa","Længe ventet tunnel indvies i Grenaa",http://tv2oj-juan2015.develop.fynskemedier.dk/artikel/277046:Norddjurs--Laenge-ventet-tunnel-indvies-i-Grenaa
"8000 Aarhus c","Projektet AktiveUnge mister fra 2016 kommunal støtte",http://tv2oj-juan2015.develop.fynskemedier.dk/artikel/277054:Aarhus--Projektet-AktiveUnge-mister-fra-2016-kommunal-stOette
"8000 Aarhus c","Arbejdsulykke: Mand i kunstig koma",http://tv2oj-juan2015.develop.fynskemedier.dk/artikel/277056:Aarhus--Arbejdsulykke--Mand-i-kunstig-koma
"8361 Hasselager","20-årig bilist udsat for trafikvold",http://tv2oj-juan2015.develop.fynskemedier.dk/artikel/277060:Aarhus--20--rig-bilist-udsat-for-trafikvold
"8000 Aarhus c","Dyreklinik udsat for tricktyveri",http://tv2oj-juan2015.develop.fynskemedier.dk/artikel/277065:Aarhus--Dyreklinik-udsat-for-tricktyveri
"8581 Nimtofte","To katte blev til 280 for Mariann ",http://tv2oj-juan2015.develop.fynskemedier.dk/artikel/277066:Syddjurs--To-katte-blev-til-280-for-Mariann
"8000 Aarhus c","Sportsklubber danner nyt stort erhvervsnetværk",http://tv2oj-juan2015.develop.fynskemedier.dk/artikel/277068:Aarhus--Sportsklubber-danner-nyt-stort-erhvervsnetvaerk
"8900 Randers C","LIVE: Randers smider point mod mestrene",http://tv2oj-juan2015.develop.fynskemedier.dk/artikel/277069:Randers--LIVE--Randers-smider-point-mod-mestrene
"8362 Hørning","18-årig østjyde med succes bag rattet",http://tv2oj-juan2015.develop.fynskemedier.dk/artikel/277073:Skanderborg--18--rig-Oestjyde-med-succes-bag-rattet
"8000 Aarhus c","Tid til at lære livreddende førstehjælp",http://tv2oj-juan2015.develop.fynskemedier.dk/artikel/277080:Aarhus--Tid-til-at-laere-livreddende-fOerstehjaelp
"8000 Aarhus c","Arbejdstilsynet finder alvorlige fejl efter arbejdsulykke",http://tv2oj-juan2015.develop.fynskemedier.dk/artikel/277086:Aarhus--Arbejdstilsynet-finder-alvorlige-fejl-efter-arbejdsulykke
"8000 Aarhus c","Aarhus-rytter er en legende i cykelcross",http://tv2oj-juan2015.develop.fynskemedier.dk/artikel/277099:Aarhus--Aarhus-rytter-er-en-legende-i-cykelcross
"8382 Hinnerup","Favrskov vil kortlægge mobilhuller",http://tv2oj-juan2015.develop.fynskemedier.dk/artikel/277101:Favrskov--Favrskov-vil-kortlaegge-mobilhuller
"Intet postnummer","Lørdag byder på gråvejr i Østjylland",http://tv2oj-juan2015.develop.fynskemedier.dk/artikel/277107:oestjylland--LOerdag-byder-p--gr-vejr-i-oestjylland
"8900 Randers C","Heidi begik selvmord efter måneders kamp for bedre pleje",http://tv2oj-juan2015.develop.fynskemedier.dk/artikel/277109:Randers--Heidi-begik-selvmord-efter-m-neders-kamp-for-bedre-pleje
