"8370 Hadsten","Ny udstilling til Hadsten",http://tv2oj-juan2015.develop.fynskemedier.dk/artikel/257165:Favrskov--Ny-udstilling-til-Hadsten
"8670 Låsby","SF: Drop ny lufthavn",http://tv2oj-juan2015.develop.fynskemedier.dk/artikel/257175:Aarhus--SF--Drop-ny-lufthavn
"8660 Skanderborg","SF: Drop ny lufthavn",http://tv2oj-juan2015.develop.fynskemedier.dk/artikel/257175:Aarhus--SF--Drop-ny-lufthavn
"8380 Trige","SF: Drop ny lufthavn",http://tv2oj-juan2015.develop.fynskemedier.dk/artikel/257175:Aarhus--SF--Drop-ny-lufthavn
"8000 Aarhus c","SF: Drop ny lufthavn",http://tv2oj-juan2015.develop.fynskemedier.dk/artikel/257175:Aarhus--SF--Drop-ny-lufthavn
"8464 Galten","Hagl over Galten",http://tv2oj-juan2015.develop.fynskemedier.dk/artikel/257180:Skanderborg--Hagl-over-Galten
"8500 Grenaa","S freder akutklinikker",http://tv2oj-juan2015.develop.fynskemedier.dk/artikel/257186:oestjylland--S-freder-akutklinikker
"8600 Silkeborg","S freder akutklinikker",http://tv2oj-juan2015.develop.fynskemedier.dk/artikel/257186:oestjylland--S-freder-akutklinikker
"8500 Grenaa","Borgmester: Jeg er tilfreds",http://tv2oj-juan2015.develop.fynskemedier.dk/artikel/257195:oestjylland--Borgmester--Jeg-er-tilfreds
"8464 Galten","Kagens Dag blev aflyst ",http://tv2oj-juan2015.develop.fynskemedier.dk/artikel/257212:Skanderborg--Kagens-Dag-blev-aflyst
"8000 Aarhus c","AGF mangler kun én sejr",http://tv2oj-juan2015.develop.fynskemedier.dk/artikel/257229:Aarhus--AGF-mangler-kun--n-sejr
"8670 Låsby","Kritik af Gaardes udmelding",http://tv2oj-juan2015.develop.fynskemedier.dk/artikel/257232:Skanderborg--Kritik-af-Gaardes-udmelding
"8660 Skanderborg","Kritik af Gaardes udmelding",http://tv2oj-juan2015.develop.fynskemedier.dk/artikel/257232:Skanderborg--Kritik-af-Gaardes-udmelding
"8700 Horsens","Stor hjælp til demente",http://tv2oj-juan2015.develop.fynskemedier.dk/artikel/257235:Horsens--Stor-hjaelp-til-demente
"8670 Låsby","Uenige om Thomasminde",http://tv2oj-juan2015.develop.fynskemedier.dk/artikel/257265:Aarhus--Uenige-om-Thomasminde
"8380 Trige","Uenige om Thomasminde",http://tv2oj-juan2015.develop.fynskemedier.dk/artikel/257265:Aarhus--Uenige-om-Thomasminde
"8000 Aarhus c","AGF kan rykke op i dag",http://tv2oj-juan2015.develop.fynskemedier.dk/artikel/257275:Aarhus--AGF-kan-rykke-op-i-dag
"8000 Aarhus c","Vil rejse penge til multiarena",http://tv2oj-juan2015.develop.fynskemedier.dk/artikel/257278:Aarhus--Vil-rejse-penge-til-multiarena
"8200 Aarhus N","Vil rejse penge til multiarena",http://tv2oj-juan2015.develop.fynskemedier.dk/artikel/257278:Aarhus--Vil-rejse-penge-til-multiarena
"8210 Aarhus V","Vil rejse penge til multiarena",http://tv2oj-juan2015.develop.fynskemedier.dk/artikel/257278:Aarhus--Vil-rejse-penge-til-multiarena
"8600 Silkeborg","Erhvervsgrunde ved motorvej",http://tv2oj-juan2015.develop.fynskemedier.dk/artikel/257291:Silkeborg--Erhvervsgrunde-ved-motorvej
"8000 Aarhus c","Undervurderer aldrig en modstander ",http://tv2oj-juan2015.develop.fynskemedier.dk/artikel/270975:Aarhus--Undervurderer-aldrig-en-modstander
"8200 Aarhus N","Forening vil have børn til at lave mere",http://tv2oj-juan2015.develop.fynskemedier.dk/artikel/270980:Aarhus--Forening-vil-have-bOern-til-at-lave-mere
"8520 Lystrup","Østjysk del i kæmpe stort rumprojekt",http://tv2oj-juan2015.develop.fynskemedier.dk/artikel/270984:Aarhus--oestjysk-del-i-kaempe-stort-rumprojekt
"8000 Aarhus c","Århus fik den anden sejr i træk",http://tv2oj-juan2015.develop.fynskemedier.dk/artikel/270986:Aarhus---rhus-fik-den-anden-sejr-i-traek
"8900 Randers C","Syltning efter alle kunstens regler ",http://tv2oj-juan2015.develop.fynskemedier.dk/artikel/270990:Randers--Syltning-efter-alle-kunstens-regler
"8620 Kjellerup","AGF uddelte kæmpeklø til Kjellerup IF ",http://tv2oj-juan2015.develop.fynskemedier.dk/artikel/270993:Aarhus--AGF-uddelte-kaempeklOe-til-Kjellerup-IF
"8600 Silkeborg","AGF uddelte kæmpeklø til Kjellerup IF ",http://tv2oj-juan2015.develop.fynskemedier.dk/artikel/270993:Aarhus--AGF-uddelte-kaempeklOe-til-Kjellerup-IF
"8620 Kjellerup","Stephan P.: Dejligt med tre kasser",http://tv2oj-juan2015.develop.fynskemedier.dk/artikel/270998:Aarhus--Stephan-P---Dejligt-med-tre-kasser
"8000 Aarhus c","Stephan P.: Dejligt med tre kasser",http://tv2oj-juan2015.develop.fynskemedier.dk/artikel/270998:Aarhus--Stephan-P---Dejligt-med-tre-kasser
"Intet postnummer","Endnu en dag med masser af byger ",http://tv2oj-juan2015.develop.fynskemedier.dk/artikel/271001:oestjylland--Endnu-en-dag-med-masser-af-byger
"8300 Odder","Odder-roer videre til VM-semifinale",http://tv2oj-juan2015.develop.fynskemedier.dk/artikel/271017:Odder--Odder-roer-videre-til-VM-semifinale
"8660 Skanderborg","Erhvervsvenligheden er i top i Østjylland",http://tv2oj-juan2015.develop.fynskemedier.dk/artikel/271019:oestjylland--Erhvervsvenligheden-er-i-top-i-oestjylland
"8000 Aarhus c","Interesse for rumforskning boomer",http://tv2oj-juan2015.develop.fynskemedier.dk/artikel/271027:oestjylland--Interesse-for-rumforskning-boomer
"8000 Aarhus c","Wieghorst roser begge mandskaber ",http://tv2oj-juan2015.develop.fynskemedier.dk/artikel/271028:Aarhus--Wieghorst-roser-begge-mandskaber
"8600 Silkeborg","Silkeborg styrker erhvervsklimaet ",http://tv2oj-juan2015.develop.fynskemedier.dk/artikel/271037:Silkeborg--Silkeborg-styrker-erhvervsklimaet
"8000 Aarhus c","Gerningsmand afsløret midt i indbrud",http://tv2oj-juan2015.develop.fynskemedier.dk/artikel/271039:Aarhus--Gerningsmand-afslOeret-midt-i-indbrud
"8260 Viby J","27-årigt knivoffer i bedring ",http://tv2oj-juan2015.develop.fynskemedier.dk/artikel/271041:Aarhus--27--rigt-knivoffer-i-bedring
"8000 Aarhus c","Aarhus Vand og Aarsleff indgår stor aftale",http://tv2oj-juan2015.develop.fynskemedier.dk/artikel/271043:oestjylland--Aarhus-Vand-og-Aarsleff-indg-r-stor-aftale
"8260 Viby J","39-årig sigtet for forsøg på manddrab",http://tv2oj-juan2015.develop.fynskemedier.dk/artikel/271045:Aarhus--39--rig-sigtet-for-forsOeg-p--manddrab
"Intet postnummer","Bundsgaard til lufthavnsmøde hos ministeren",http://tv2oj-juan2015.develop.fynskemedier.dk/artikel/271052:Aarhus--Bundsgaard-til-lufthavnsmOede-hos-ministeren
"8210 Aarhus V","Slog bilist i hovedet efter påkørsel ",http://tv2oj-juan2015.develop.fynskemedier.dk/artikel/271056:Aarhus--Slog-bilist-i-hovedet-efter-p-kOersel
"8500 Grenaa","Usikkerhed om letbane til Grenaa",http://tv2oj-juan2015.develop.fynskemedier.dk/artikel/271057:oestjylland--Usikkerhed-om-letbane-til-Grenaa
"8000 Aarhus c","Aurora har lagt til kaj ved Festugen",http://tv2oj-juan2015.develop.fynskemedier.dk/artikel/271066:Aarhus--Aurora-har-lagt-til-kaj-ved-Festugen
"8300 Odder","Elander og Lolk videre til VM-finale",http://tv2oj-juan2015.develop.fynskemedier.dk/artikel/271069:Odder--Elander-og-Lolk-videre-til-VM-finale
"8600 Silkeborg","Silkeborg får besøg af AGF i DBU Pokalen",http://tv2oj-juan2015.develop.fynskemedier.dk/artikel/271074:oestjylland--Silkeborg-f-r-besOeg-af-AGF-i-DBU-Pokalen
"8000 Aarhus c","Silkeborg får besøg af AGF i DBU Pokalen",http://tv2oj-juan2015.develop.fynskemedier.dk/artikel/271074:oestjylland--Silkeborg-f-r-besOeg-af-AGF-i-DBU-Pokalen
"8000 Aarhus c","Knivdrama: 39-årig fængslet i fire uger",http://tv2oj-juan2015.develop.fynskemedier.dk/artikel/271076:Aarhus--Knivdrama--39--rig-faengslet-i-fire-uger
"8000 Aarhus c","Pedersen om SIF-kamp: Bliver specielt",http://tv2oj-juan2015.develop.fynskemedier.dk/artikel/271077:Aarhus--Pedersen-om-SIF-kamp--Bliver-specielt
"8700 Horsens","Hjælp politiet: Tyve smuttet med 400 møbler",http://tv2oj-juan2015.develop.fynskemedier.dk/artikel/271085:Horsens--Hjaelp-politiet--Tyve-smuttet-med-400-mOebler
"8000 Aarhus c","Få en rundtur i Scandics mobile hotel",http://tv2oj-juan2015.develop.fynskemedier.dk/artikel/271086:Aarhus--F--en-rundtur-i-Scandics-mobile-hotel
"8000 Aarhus c","Blev taget på brysterne og fik en lussing",http://tv2oj-juan2015.develop.fynskemedier.dk/artikel/271093:Aarhus--Blev-taget-p--brysterne-og-fik-en-lussing
"8300 Odder","Facebook-krænker får lang straf for at misbruge børn",http://tv2oj-juan2015.develop.fynskemedier.dk/artikel/271097:Odder--Facebook-kraenker-f-r-lang-straf-for-at-misbruge-bOern
"8000 Aarhus c","TV2OJ sender direkte fra bispevielsen",http://tv2oj-juan2015.develop.fynskemedier.dk/artikel/271098:TV2OJnyt--TV2OJ-sender-direkte-fra-bispevielsen
"8680 Ry","Fire år for at misbruge sin steddatter ",http://tv2oj-juan2015.develop.fynskemedier.dk/artikel/271099:Skanderborg--Fire--r-for-at-misbruge-sin-steddatter
"8000 Aarhus c","Få smagsprøve på tre slags festivaler ",http://tv2oj-juan2015.develop.fynskemedier.dk/artikel/271109:Aarhus--F--smagsprOeve-p--tre-slags-festivaler
"8000 Aarhus c","Gratis koncert med Poul Krebs fredag",http://tv2oj-juan2015.develop.fynskemedier.dk/artikel/271112:Aarhus--Gratis-koncert-med-Poul-Krebs-fredag
"8500 Grenaa","Tysk militær øver eksplosioner i Grenaa",http://tv2oj-juan2015.develop.fynskemedier.dk/artikel/271120:Norddjurs--Tysk-militaer-Oever-eksplosioner-i-Grenaa
"8210 Aarhus V","Skud afgivet i Aarhus – en person i politiets varetægt",http://tv2oj-juan2015.develop.fynskemedier.dk/artikel/271123:Aarhus--Skud-afgivet-i-Aarhus---en-person-i-politiets-varetaegt
"8000 Aarhus c","Sara Slott pressede igen verdensmester",http://tv2oj-juan2015.develop.fynskemedier.dk/artikel/271134:Aarhus--Sara-Slott-pressede-igen-verdensmester
"8220 Brabrand","Kunstgræsbane giver drømme om en Zlatan ",http://tv2oj-juan2015.develop.fynskemedier.dk/artikel/271137:Aarhus--Kunstgraesbane-giver-drOemme-om-en-Zlatan
"8883 Gjern","Vil behandle demente med et sanserum ",http://tv2oj-juan2015.develop.fynskemedier.dk/artikel/271142:Silkeborg--Vil-behandle-demente-med-et-sanserum
"Intet postnummer","Igen gråt vejr med masser af byger",http://tv2oj-juan2015.develop.fynskemedier.dk/artikel/271150:oestjylland--Igen-gr-t-vejr-med-masser-af-byger
"8200 Aarhus N","Brand i kolonihavehus torsdag aften ",http://tv2oj-juan2015.develop.fynskemedier.dk/artikel/271153:Aarhus--Brand-i-kolonihavehus-torsdag-aften
"8300 Odder","Roer med i VM-finale og er nu klar til OL",http://tv2oj-juan2015.develop.fynskemedier.dk/artikel/271170:Odder--Roer-med-i-VM-finale-og-er-nu-klar-til-OL
"Intet postnummer","DF-ordførerskaberne er fordelt: Seks østjyder får poster",http://tv2oj-juan2015.develop.fynskemedier.dk/artikel/271180:oestjylland--DF-ordfOererskaberne-er-fordelt--Seks-Oestjyder-f-r-poster
"8660 Skanderborg","Arbejde hjalp Laura ud af ensomheden",http://tv2oj-juan2015.develop.fynskemedier.dk/artikel/271184:Skanderborg--Arbejde-hjalp-Laura-ud-af-ensomheden
"8900 Randers C","Vil have flere butikker med på nethandel",http://tv2oj-juan2015.develop.fynskemedier.dk/artikel/271191:Randers--Vil-have-flere-butikker-med-p--nethandel
"8000 Aarhus c","Sejlere skal ""flyve"" på Aarhus Bugten",http://tv2oj-juan2015.develop.fynskemedier.dk/artikel/271195:Aarhus--Sejlere-skal--flyve--p--Aarhus-Bugten
"8000 Aarhus c","Borgmester byder ny biskop velkommen",http://tv2oj-juan2015.develop.fynskemedier.dk/artikel/271202:Aarhus--Borgmester-byder-ny-biskop-velkommen
"8210 Aarhus V","Mand anholdt efter skudepisode i det vestlige Aarhus",http://tv2oj-juan2015.develop.fynskemedier.dk/artikel/271203:Aarhus--Mand-anholdt-efter-skudepisode-i-det-vestlige-Aarhus
"8660 Skanderborg","Nu er den klar: Festlig åbning af ny bro ",http://tv2oj-juan2015.develop.fynskemedier.dk/artikel/271210:Skanderborg--Nu-er-den-klar--Festlig--bning-af-ny-bro
"8230 Åbyhøj","36-årig anholdt efter en stribe indbrud",http://tv2oj-juan2015.develop.fynskemedier.dk/artikel/271212:Aarhus--36--rig-anholdt-efter-en-stribe-indbrud
"8000 Aarhus c","36-årig anholdt efter en stribe indbrud",http://tv2oj-juan2015.develop.fynskemedier.dk/artikel/271212:Aarhus--36--rig-anholdt-efter-en-stribe-indbrud
"8530 Hjortshøj","Mand tæskede løs på en bekendt",http://tv2oj-juan2015.develop.fynskemedier.dk/artikel/271217:Aarhus--Mand-taeskede-lOes-p--en-bekendt
"8500 Grenaa","Ville hjælpe, blev truet med en kniv",http://tv2oj-juan2015.develop.fynskemedier.dk/artikel/271218:Norddjurs--Ville-hjaelpe--blev-truet-med-en-kniv
"8000 Aarhus c","Fredag åbner madfestival med 250 boder",http://tv2oj-juan2015.develop.fynskemedier.dk/artikel/271219:Aarhus--Fredag--bner-madfestival-med-250-boder
"8000 Aarhus c","Skoleelever smager på nødhjælp",http://tv2oj-juan2015.develop.fynskemedier.dk/artikel/271223:Aarhus--Skoleelever-smager-p--nOedhjaelp
"8000 Aarhus c","Ovartaci er poppet op i Aarhus",http://tv2oj-juan2015.develop.fynskemedier.dk/artikel/271248:Aarhus--Ovartaci-er-poppet-op-i-Aarhus
"8400 Ebeltoft","Kørte galt og stak af med narkotika",http://tv2oj-juan2015.develop.fynskemedier.dk/artikel/271252:Syddjurs--KOerte-galt-og-stak-af-med-narkotika
"8000 Aarhus c","Thailandske kvinder smidt ud af landet",http://tv2oj-juan2015.develop.fynskemedier.dk/artikel/271257:Aarhus--Thailandske-kvinder-smidt-ud-af-landet
"8000 Aarhus c","Sigtet for drabsforsøg blev løsladt efter grundlovsforhør ",http://tv2oj-juan2015.develop.fynskemedier.dk/artikel/271258:Aarhus--Sigtet-for-drabsforsOeg-blev-lOesladt-efter-grundlovsforhOer
"8000 Aarhus c","Glad Folmer trods svingende billetsalg",http://tv2oj-juan2015.develop.fynskemedier.dk/artikel/271262:Aarhus--Glad-Folmer-trods-svingende-billetsalg
"Intet postnummer","Efter en våd weekend vender solen tilbage",http://tv2oj-juan2015.develop.fynskemedier.dk/artikel/271266:oestjylland--Efter-en-v-d-weekend-vender-solen-tilbage
"8260 Viby J","Leder efter tre tyve fanget på video",http://tv2oj-juan2015.develop.fynskemedier.dk/artikel/271273:Aarhus--Leder-efter-tre-tyve-fanget-p--video
"8900 Randers C","Randers henter spiller tilbage fra KIF",http://tv2oj-juan2015.develop.fynskemedier.dk/artikel/271275:Randers--Randers-henter-spiller-tilbage-fra-KIF
"8500 Grenaa","Borgmestre: Letbanen må og skal åbne til tiden",http://tv2oj-juan2015.develop.fynskemedier.dk/artikel/271280:Syddjurs--Borgmestre--Letbanen-m--og-skal--bne-til-tiden
"8500 Grenaa","Blev overrasket af politiet i en have",http://tv2oj-juan2015.develop.fynskemedier.dk/artikel/271285:Norddjurs--Blev-overrasket-af-politiet-i-en-have
"8000 Aarhus c","Hummeren er vendt tilbage til Aarhus Bugt ",http://tv2oj-juan2015.develop.fynskemedier.dk/artikel/271289:Aarhus--Hummeren-er-vendt-tilbage-til-Aarhus-Bugt
"8000 Aarhus c","Modtryk slår oplagsrekord med ny bog",http://tv2oj-juan2015.develop.fynskemedier.dk/artikel/271295:Aarhus--Modtryk-sl-r-oplagsrekord-med-ny-bog
"8900 Randers C","Heidi trodser lægernes dom og ror igen ",http://tv2oj-juan2015.develop.fynskemedier.dk/artikel/271298:Randers--Heidi-trodser-laegernes-dom-og-ror-igen
"8660 Skanderborg","Skanderborg fik store stryg af Skjern ",http://tv2oj-juan2015.develop.fynskemedier.dk/artikel/271300:Skanderborg--Skanderborg-fik-store-stryg-af-Skjern
"8900 Randers C","Randers HK kom rigtig godt fra land ",http://tv2oj-juan2015.develop.fynskemedier.dk/artikel/271303:Randers--Randers-HK-kom-rigtig-godt-fra-land
"8400 Ebeltoft","Smed narko fra sig efter uheld: Tre fængslet",http://tv2oj-juan2015.develop.fynskemedier.dk/artikel/271310:Syddjurs--Smed-narko-fra-sig-efter-uheld--Tre-faengslet
"8200 Aarhus N","Fremad uddelte øretæver til Skovbakken",http://tv2oj-juan2015.develop.fynskemedier.dk/artikel/271318:Aarhus--Fremad-uddelte-Oeretaever-til-Skovbakken
"8300 Odder","Ny østjysk triumf ved VM i roning i Frankrig",http://tv2oj-juan2015.develop.fynskemedier.dk/artikel/271342:oestjylland--Ny-Oestjysk-triumf-ved-VM-i-roning-i-Frankrig
"8000 Aarhus c","Ny østjysk triumf ved VM i roning i Frankrig",http://tv2oj-juan2015.develop.fynskemedier.dk/artikel/271342:oestjylland--Ny-Oestjysk-triumf-ved-VM-i-roning-i-Frankrig
"8362 Hørning","Hørning er lørdag uden varmt vand ",http://tv2oj-juan2015.develop.fynskemedier.dk/artikel/271350:Skanderborg--HOerning-er-lOerdag-uden-varmt-vand
"8000 Aarhus c","To mænd røvet, efter de kørte med pirattaxa",http://tv2oj-juan2015.develop.fynskemedier.dk/artikel/271354:Aarhus--To-maend-rOevet--efter-de-kOerte-med-pirattaxa
"8000 Aarhus c","12 anholdt for dårlig opførsel fredag nat",http://tv2oj-juan2015.develop.fynskemedier.dk/artikel/271356:Aarhus--12-anholdt-for-d-rlig-opfOersel-fredag-nat
"8400 Ebeltoft","Borgerne på Mols kæmper for overlevelse ",http://tv2oj-juan2015.develop.fynskemedier.dk/artikel/271365:Syddjurs--Borgerne-p--Mols-kaemper-for-overlevelse
"8400 Ebeltoft","Fremtidsforsker: Mols er på rette vej",http://tv2oj-juan2015.develop.fynskemedier.dk/artikel/271369:Syddjurs--Fremtidsforsker--Mols-er-p--rette-vej
"8330 Beder","77-årig smed tricktyv på porten ",http://tv2oj-juan2015.develop.fynskemedier.dk/artikel/271373:Aarhus--77--rig-smed-tricktyv-p--porten
"8000 Aarhus c","Bispevielse med sommerfugle i maven ",http://tv2oj-juan2015.develop.fynskemedier.dk/artikel/271378:Aarhus--Bispevielse-med-sommerfugle-i-maven
"8660 Skanderborg","Politiet advarer mod store huller i vejene",http://tv2oj-juan2015.develop.fynskemedier.dk/artikel/271380:Skanderborg--Politiet-advarer-mod-store-huller-i-vejene
"8660 Skanderborg","Helt ny bro skyllet væk i regnen",http://tv2oj-juan2015.develop.fynskemedier.dk/artikel/271387:Skanderborg--Helt-ny-bro-skyllet-vaek-i-regnen
"8900 Randers C","Dørmand fik knytnæveslag i ansigtet",http://tv2oj-juan2015.develop.fynskemedier.dk/artikel/271391:Randers--DOermand-fik-knytnaeveslag-i-ansigtet
"8300 Odder","Elander og Lolk måtte nøjes med femteplads ved VM",http://tv2oj-juan2015.develop.fynskemedier.dk/artikel/271395:Odder--Elander-og-Lolk-m-tte-nOejes-med-femteplads-ved-VM
"Intet postnummer","Sol og lunere vejr er på vej tilbage ",http://tv2oj-juan2015.develop.fynskemedier.dk/artikel/271402:oestjylland--Sol-og-lunere-vejr-er-p--vej-tilbage
"8500 Grenaa","Borgmestre: Banedanmark og Letbanen bør kunne tale sammen ",http://tv2oj-juan2015.develop.fynskemedier.dk/artikel/271405:Syddjurs--Borgmestre--Banedanmark-og-Letbanen-bOer-kunne-tale-sammen
"8000 Aarhus c","Livagtige skulpturer af bådflygtninge vækker debat",http://tv2oj-juan2015.develop.fynskemedier.dk/artikel/271412:Aarhus--Livagtige-skulpturer-af-b-dflygtninge-vaekker-debat
"Intet postnummer","Hav kontanter klar: Systemet for betalingskort er nede",http://tv2oj-juan2015.develop.fynskemedier.dk/artikel/271424:oestjylland--Hav-kontanter-klar--Systemet-for-betalingskort-er-nede
"Intet postnummer","Efter nedbrud: Dankortsystem fungerer igen",http://tv2oj-juan2015.develop.fynskemedier.dk/artikel/271425:oestjylland--Efter-nedbrud--Dankortsystem-fungerer-igen
"8700 Horsens","Elev opdagede brand på efterskole",http://tv2oj-juan2015.develop.fynskemedier.dk/artikel/271439:Horsens--Elev-opdagede-brand-p--efterskole
"8230 Åbyhøj","Løb over for rødt lys og blev ramt af bil ",http://tv2oj-juan2015.develop.fynskemedier.dk/artikel/271442:Aarhus--LOeb-over-for-rOedt-lys-og-blev-ramt-af-bil
"8660 Skanderborg","Veteranmaskiner bliver vist frem med et smil på læben ",http://tv2oj-juan2015.develop.fynskemedier.dk/artikel/271446:Skanderborg--Veteranmaskiner-bliver-vist-frem-med-et-smil-p--laeben
"8660 Skanderborg","To veje er stadig lukket i Skanderborg efter massiv regn",http://tv2oj-juan2015.develop.fynskemedier.dk/artikel/271449:Skanderborg--To-veje-er-stadig-lukket-i-Skanderborg-efter-massiv-regn
"8000 Aarhus c","Rådmænd ønsker at bevare shelters",http://tv2oj-juan2015.develop.fynskemedier.dk/artikel/271455:Aarhus--R-dmaend-Oensker-at-bevare-shelters
"8000 Aarhus c","LIVE: Følg vielsen af den nye biskop her",http://tv2oj-juan2015.develop.fynskemedier.dk/artikel/271456:oestjylland--LIVE--FOelg-vielsen-af-den-nye-biskop-her
"8000 Aarhus c","ARKIV: Kjeld Holm bispeviet i 1994",http://tv2oj-juan2015.develop.fynskemedier.dk/artikel/271460:oestjylland--ARKIV--Kjeld-Holm-bispeviet-i-1994
"8520 Lystrup","48-årig kvinde kørte ind i autoværn",http://tv2oj-juan2015.develop.fynskemedier.dk/artikel/271462:Aarhus--48--rig-kvinde-kOerte-ind-i-autovaern
"8000 Aarhus c","Kjeld Holm: Ny biskop skal finde sine egne veje",http://tv2oj-juan2015.develop.fynskemedier.dk/artikel/271463:oestjylland--Kjeld-Holm--Ny-biskop-skal-finde-sine-egne-veje
"8000 Aarhus c","Biskop vil være nærværende i hele stiftet",http://tv2oj-juan2015.develop.fynskemedier.dk/artikel/271468:oestjylland--Biskop-vil-vaere-naervaerende-i-hele-stiftet
"8000 Aarhus c","VIDEO: Royalt besøg i Aarhus Domkirke",http://tv2oj-juan2015.develop.fynskemedier.dk/artikel/271470:Aarhus--VIDEO--Royalt-besOeg-i-Aarhus-Domkirke
"8000 Aarhus c","Her ankommer ny biskop til domkirken ",http://tv2oj-juan2015.develop.fynskemedier.dk/artikel/271472:Aarhus--Her-ankommer-ny-biskop-til-domkirken
"8000 Aarhus c","Billedserie: Kom med til bispevielse",http://tv2oj-juan2015.develop.fynskemedier.dk/artikel/271473:oestjylland--Billedserie--Kom-med-til-bispevielse
"8000 Aarhus c","VIDEO: Her bliver Henrik Wigh-Poulsen ny biskop",http://tv2oj-juan2015.develop.fynskemedier.dk/artikel/271476:oestjylland--VIDEO--Her-bliver-Henrik-Wigh-Poulsen-ny-biskop
"Intet postnummer","Forbrugere investerer i produktion af lokale råvarer",http://tv2oj-juan2015.develop.fynskemedier.dk/artikel/271483:Silkeborg--Forbrugere-investerer-i-produktion-af-lokale-r-varer
"8850 Bjerringbro","BSV indtager førsteplads i herreligaen",http://tv2oj-juan2015.develop.fynskemedier.dk/artikel/271485:Silkeborg--BSV-indtager-fOersteplads-i-herreligaen
"8000 Aarhus c","Aarhusianer vandt bronze ved duatlon-VM",http://tv2oj-juan2015.develop.fynskemedier.dk/artikel/271487:Aarhus--Aarhusianer-vandt-bronze-ved-duatlon-VM
"Intet postnummer","Mandag byder på masser af sol i Østjylland",http://tv2oj-juan2015.develop.fynskemedier.dk/artikel/271489:oestjylland--Mandag-byder-p--masser-af-sol-i-oestjylland
"8000 Aarhus c","Lokale sejlere fik en tredjeplads",http://tv2oj-juan2015.develop.fynskemedier.dk/artikel/271493:Aarhus--Lokale-sejlere-fik-en-tredjeplads
"8000 Aarhus c","Danmarks bedste hotdog blev kåret på Tangkrogen",http://tv2oj-juan2015.develop.fynskemedier.dk/artikel/271497:Aarhus--Danmarks-bedste-hotdog-blev-k-ret-p--Tangkrogen
"8000 Aarhus c","Ny biskop: Det var en fantastisk dag",http://tv2oj-juan2015.develop.fynskemedier.dk/artikel/271500:Aarhus--Ny-biskop--Det-var-en-fantastisk-dag
"8660 Skanderborg","Skybrud: Sommerhuse er søndag aften truet af oversvømmelse",http://tv2oj-juan2015.develop.fynskemedier.dk/artikel/271501:Skanderborg--Skybrud--Sommerhuse-er-sOendag-aften-truet-af-oversvOemmelse
"8300 Odder","Flygtninge blev inviteret på kaffe i Odder",http://tv2oj-juan2015.develop.fynskemedier.dk/artikel/271533:Odder--Flygtninge-blev-inviteret-p--kaffe-i-Odder
"8600 Silkeborg","Anføreren klar til jubilæum mod Helsingør",http://tv2oj-juan2015.develop.fynskemedier.dk/artikel/271536:Silkeborg--AnfOereren-klar-til-jubilaeum-mod-HelsingOer
"8900 Randers C","Datoen på årets ældretræf er fundet",http://tv2oj-juan2015.develop.fynskemedier.dk/artikel/271541:Randers--Datoen-p---rets-aeldretraef-er-fundet
"8000 Aarhus c","Prins Henrik skar tænder ad hummeren på Food Festival ",http://tv2oj-juan2015.develop.fynskemedier.dk/artikel/271550:Aarhus--Prins-Henrik-skar-taender-ad-hummeren-p--Food-Festival
"8450 Hammel","40.000 til vådt men godt Hestemarked",http://tv2oj-juan2015.develop.fynskemedier.dk/artikel/271553:Favrskov--40-000-til-v-dt-men-godt-Hestemarked
"8000 Aarhus c","Food Festival satte rekord på Tangkrogen ",http://tv2oj-juan2015.develop.fynskemedier.dk/artikel/271565:Aarhus--Food-Festival-satte-rekord-p--Tangkrogen
"8000 Aarhus c","47-årig nikkede bartender en skalle ",http://tv2oj-juan2015.develop.fynskemedier.dk/artikel/271566:Aarhus--47--rig-nikkede-bartender-en-skalle
"8983 Gjerlev J","Tænker kreativt for at huse flygtninge ",http://tv2oj-juan2015.develop.fynskemedier.dk/artikel/271573:oestjylland--Taenker-kreativt-for-at-huse-flygtninge
"8660 Skanderborg","Kæmper for at redde huse fra oversvømmelse",http://tv2oj-juan2015.develop.fynskemedier.dk/artikel/271583:Skanderborg--Kaemper-for-at-redde-huse-fra-oversvOemmelse
"8900 Randers C","Agesen tilbage for Randers i reservekamp ",http://tv2oj-juan2015.develop.fynskemedier.dk/artikel/271590:Randers--Agesen-tilbage-for-Randers-i-reservekamp
"8660 Skanderborg","14 får er druknet i vandmasserne",http://tv2oj-juan2015.develop.fynskemedier.dk/artikel/271596:Skanderborg--14-f-r-er-druknet-i-vandmasserne
"8000 Aarhus c","Classic Race Aarhus har en ny leder klar ",http://tv2oj-juan2015.develop.fynskemedier.dk/artikel/271597:Aarhus--Classic-Race-Aarhus-har-en-ny-leder-klar
"8900 Randers C","Lundberg i spil som månedens bedste ",http://tv2oj-juan2015.develop.fynskemedier.dk/artikel/271601:Randers--Lundberg-i-spil-som-m-nedens-bedste
"8200 Aarhus N","Sovende mand snuppet for indbrud",http://tv2oj-juan2015.develop.fynskemedier.dk/artikel/271607:Aarhus--Sovende-mand-snuppet-for-indbrud
"8260 Viby J","Ny kritik af Forenede Care og Bøgeskovhus ",http://tv2oj-juan2015.develop.fynskemedier.dk/artikel/271611:Aarhus--Ny-kritik-af-Forenede-Care-og-BOegeskovhus
"8200 Aarhus N","Vestas står til at miste stor ordre i England",http://tv2oj-juan2015.develop.fynskemedier.dk/artikel/271614:Aarhus--Vestas-st-r-til-at-miste-stor-ordre-i-England
"8660 Skanderborg","Vandmasser slider på gravsteder",http://tv2oj-juan2015.develop.fynskemedier.dk/artikel/271622:Skanderborg--Vandmasser-slider-p--gravsteder
"8000 Aarhus c","Byrådsmedlem vil have opsagt samarbejde",http://tv2oj-juan2015.develop.fynskemedier.dk/artikel/271623:Aarhus--Byr-dsmedlem-vil-have-opsagt-samarbejde
"8260 Viby J","Chauffør slap heldigt, da lastbil væltede",http://tv2oj-juan2015.develop.fynskemedier.dk/artikel/271634:Aarhus--ChauffOer-slap-heldigt--da-lastbil-vaeltede
"Intet postnummer","Regionsråd har indgået forlig om budget",http://tv2oj-juan2015.develop.fynskemedier.dk/artikel/271638:oestjylland--Regionsr-d-har-indg-et-forlig-om-budget
